Date,Name,Amount,Analysis_Status,Exclusion_Reason,Category,Source,Type,Status,Date_parsed,Month,MonthName,MonthNum
12/31/2025,,10.75,Excluded,Money In / Refund,Excluded,Personal,General Card Deposit,Completed,2025-12-31,2025-12,December,12
12/31/2025,MTA*NYCT PAYGO,-2.9,Included (True Spend),,Transportation,Business/Main,General PayPal Debit Card Transaction,Completed,2025-12-31,2025-12,December,12
12/31/2025,1037 NOSTRAND DELI LLC,-6.76,Included (True Spend),,Grocery/Daily,Business/Main,General PayPal Debit Card Transaction,Completed,2025-12-31,2025-12,December,12
12/31/2025,1037 NOSTRAND DELI LLC,-6.76,Included (True Spend),,Grocery/Daily,Business/Main,General Authorization,Completed,2025-12-31,2025-12,December,12
12/31/2025,Apple Services,-10.99,Included (True Spend),,Tech & Subs,Personal,PreApproved Payment Bill User Payment,Completed,2025-12-31,2025-12,December,12
12/31/2025,MTA*NYCT PAYGO,-2.9,Included (True Spend),,Transportation,Business/Main,General Authorization,Completed,2025-12-31,2025-12,December,12
12/31/2025,PayPal,2.9,Excluded,Money In / Refund,Excluded,Business/Main,Reversal of General Account Hold,Completed,2025-12-31,2025-12,December,12
12/31/2025,PayPal,6.76,Excluded,Money In / Refund,Excluded,Business/Main,Reversal of General Account Hold,Completed,2025-12-31,2025-12,December,12
12/30/2025,MTA*NYCT PAYGO,-2.9,Excluded,Non-Finalized (Status: Pending),Excluded,Business/Main,General Authorization,Pending,2025-12-30,2025-12,December,12
12/30/2025,TARGET.COM,-70.59,Excluded,Non-Finalized (Status: Reversed),Excluded,Business/Main,Void of Authorization,Reversed,2025-12-30,2025-12,December,12
12/30/2025,PayPal,-24.93,Excluded,Non-Finalized (Status: Pending),Excluded,Business/Main,Account Hold for Open Authorization,Pending,2025-12-30,2025-12,December,12
12/30/2025,"Uber Technologies, Inc",-24.93,Included (True Spend),,Transportation,Business/Main,PreApproved Payment Bill User Payment,Completed,2025-12-30,2025-12,December,12
12/30/2025,"Uber Technologies, Inc",-23.95,Excluded,Non-Finalized (Status: Pending),Excluded,Business/Main,General Authorization,Pending,2025-12-30,2025-12,December,12
12/30/2025,"Uber Technologies, Inc",-23.73,Included (True Spend),,Transportation,Business/Main,PreApproved Payment Bill User Payment,Completed,2025-12-30,2025-12,December,12
12/30/2025,PayPal Inc.,-8.86,Included (True Spend),,Financial Services,Business/Main,Other,Completed,2025-12-30,2025-12,December,12
12/30/2025,PayPal,-8.49,Excluded,Non-Finalized (Status: Pending),Excluded,Business/Main,Account Hold for Open Authorization,Pending,2025-12-30,2025-12,December,12
12/30/2025,WONDER,-8.49,Excluded,Non-Finalized (Status: Pending),Excluded,Business/Main,General Authorization,Pending,2025-12-30,2025-12,December,12
12/30/2025,WONDER,-8.49,Included (True Spend),,Dining/Restaurants,Business/Main,General PayPal Debit Card Transaction,Completed,2025-12-30,2025-12,December,12
12/30/2025,PayPal,-1.7,Excluded,Non-Finalized (Status: Pending),Excluded,Business/Main,Account Hold for Open Authorization,Pending,2025-12-30,2025-12,December,12
12/30/2025,PayPal,1.7,Excluded,Money In / Refund,Excluded,Business/Main,Reversal of General Account Hold,Completed,2025-12-30,2025-12,December,12
12/30/2025,PayPal,8.49,Excluded,Money In / Refund,Excluded,Business/Main,Reversal of General Account Hold,Completed,2025-12-30,2025-12,December,12
12/30/2025,PayPal,8.86,Excluded,Money In / Refund,Excluded,Business/Main,Reversal of General Account Hold,Completed,2025-12-30,2025-12,December,12
12/30/2025,,22.03,Excluded,Non-Finalized (Status: Pending),Excluded,Business/Main,Bank Deposit to PP Account ,Pending,2025-12-30,2025-12,December,12
12/30/2025,PayPal,24.93,Excluded,Money In / Refund,Excluded,Business/Main,Reversal of General Account Hold,Completed,2025-12-30,2025-12,December,12
12/30/2025,MARBLE,49.0,Excluded,Non-Finalized (Status: Denied),Excluded,Business/Main,General PayPal Debit Card Transaction,Denied,2025-12-30,2025-12,December,12
12/30/2025,PayPal,-2.9,Excluded,Non-Finalized (Status: Pending),Excluded,Business/Main,Account Hold for Open Authorization,Pending,2025-12-30,2025-12,December,12
12/29/2025,PayPal,-3.9,Excluded,Non-Finalized (Status: Pending),Excluded,Business/Main,Account Hold for Open Authorization,Pending,2025-12-29,2025-12,December,12
12/29/2025,APPLE.COM/BILL,-12.99,Included (True Spend),,Tech & Subs,Business/Main,General Authorization,Completed,2025-12-29,2025-12,December,12
12/29/2025,1037 NOSTRAND DELI LLC,-6.76,Excluded,Non-Finalized (Status: Pending),Excluded,Business/Main,General Authorization,Pending,2025-12-29,2025-12,December,12
12/29/2025,1037 NOSTRAND DELI LLC,-7.8,Included (True Spend),,Grocery/Daily,Business/Main,General Authorization,Completed,2025-12-29,2025-12,December,12
12/29/2025,1037 NOSTRAND DELI LLC,-7.8,Included (True Spend),,Grocery/Daily,Business/Main,General PayPal Debit Card Transaction,Completed,2025-12-29,2025-12,December,12
12/29/2025,PayPal,-20.58,Excluded,Non-Finalized (Status: Pending),Excluded,Business/Main,Account Hold for Open Authorization,Pending,2025-12-29,2025-12,December,12
12/29/2025,APPLE.COM/BILL,-12.99,Included (True Spend),,Tech & Subs,Business/Main,General PayPal Debit Card Transaction,Completed,2025-12-29,2025-12,December,12
12/29/2025,WONDER,-20.58,Included (True Spend),,Dining/Restaurants,Business/Main,General PayPal Debit Card Transaction,Completed,2025-12-29,2025-12,December,12
12/29/2025,WONDER,-20.58,Excluded,Non-Finalized (Status: Pending),Excluded,Business/Main,General Authorization,Pending,2025-12-29,2025-12,December,12
12/29/2025,PayPal,-6.76,Excluded,Non-Finalized (Status: Pending),Excluded,Business/Main,Account Hold for Open Authorization,Pending,2025-12-29,2025-12,December,12
12/29/2025,PayPal,20.58,Excluded,Money In / Refund,Excluded,Business/Main,Reversal of General Account Hold,Completed,2025-12-29,2025-12,December,12
12/29/2025,WONDER,-3.9,Excluded,Non-Finalized (Status: Pending),Excluded,Business/Main,General Authorization,Pending,2025-12-29,2025-12,December,12
12/29/2025,APPLE.COM/BILL,-2.17,Included (True Spend),,Tech & Subs,Business/Main,General PayPal Debit Card Transaction,Completed,2025-12-29,2025-12,December,12
12/29/2025,APPLE.COM/BILL,-2.17,Included (True Spend),,Tech & Subs,Business/Main,General Authorization,Completed,2025-12-29,2025-12,December,12
12/29/2025,PayPal,2.17,Excluded,Money In / Refund,Excluded,Business/Main,Reversal of General Account Hold,Completed,2025-12-29,2025-12,December,12
12/29/2025,PayPal,3.9,Excluded,Money In / Refund,Excluded,Business/Main,Reversal of General Account Hold,Completed,2025-12-29,2025-12,December,12
12/29/2025,PayPal,7.8,Excluded,Money In / Refund,Excluded,Business/Main,Reversal of General Account Hold,Completed,2025-12-29,2025-12,December,12
12/29/2025,PayPal,12.99,Excluded,Money In / Refund,Excluded,Business/Main,Reversal of General Account Hold,Completed,2025-12-29,2025-12,December,12
12/29/2025,WONDER,-3.9,Included (True Spend),,Dining/Restaurants,Business/Main,General PayPal Debit Card Transaction,Completed,2025-12-29,2025-12,December,12
12/28/2025,T & T Organic Market I,-20.8,Included (True Spend),,Grocery/Daily,Business/Main,General PayPal Debit Card Transaction,Completed,2025-12-28,2025-12,December,12
12/28/2025,WONDER,-19.88,Excluded,Non-Finalized (Status: Pending),Excluded,Business/Main,General Authorization,Pending,2025-12-28,2025-12,December,12
12/28/2025,PayPal,-19.88,Excluded,Non-Finalized (Status: Pending),Excluded,Business/Main,Account Hold for Open Authorization,Pending,2025-12-28,2025-12,December,12
12/28/2025,T & T Organic Market I,-20.8,Included (True Spend),,Grocery/Daily,Business/Main,General Authorization,Completed,2025-12-28,2025-12,December,12
12/28/2025,PayPal,-44.48,Excluded,Non-Finalized (Status: Pending),Excluded,Business/Main,Account Hold for Open Authorization,Pending,2025-12-28,2025-12,December,12
12/28/2025,WONDER,-28.2,Included (True Spend),,Dining/Restaurants,Business/Main,General Authorization,Completed,2025-12-28,2025-12,December,12
12/28/2025,WONDER,-44.48,Included (True Spend),,Dining/Restaurants,Business/Main,General PayPal Debit Card Transaction,Completed,2025-12-28,2025-12,December,12
12/28/2025,WONDER,-44.48,Excluded,Non-Finalized (Status: Pending),Excluded,Business/Main,General Authorization,Pending,2025-12-28,2025-12,December,12
12/28/2025,APPLE.COM/BILL,-12.99,Excluded,Non-Finalized (Status: Pending),Excluded,Business/Main,General Authorization,Pending,2025-12-28,2025-12,December,12
12/28/2025,WONDER,-19.88,Included (True Spend),,Dining/Restaurants,Business/Main,General PayPal Debit Card Transaction,Completed,2025-12-28,2025-12,December,12
12/28/2025,WONDER,-28.2,Included (True Spend),,Dining/Restaurants,Business/Main,General PayPal Debit Card Transaction,Completed,2025-12-28,2025-12,December,12
12/28/2025,PayPal,-12.99,Excluded,Non-Finalized (Status: Pending),Excluded,Business/Main,Account Hold for Open Authorization,Pending,2025-12-28,2025-12,December,12
12/28/2025,PayPal,19.88,Excluded,Money In / Refund,Excluded,Business/Main,Reversal of General Account Hold,Completed,2025-12-28,2025-12,December,12
12/28/2025,PayPal,44.48,Excluded,Money In / Refund,Excluded,Business/Main,Reversal of General Account Hold,Completed,2025-12-28,2025-12,December,12
12/28/2025,PayPal,20.8,Excluded,Money In / Refund,Excluded,Business/Main,Reversal of General Account Hold,Completed,2025-12-28,2025-12,December,12
12/28/2025,1037 NOSTRAND DELI LLC,-7.8,Excluded,Non-Finalized (Status: Pending),Excluded,Business/Main,General Authorization,Pending,2025-12-28,2025-12,December,12
12/28/2025,PayPal,28.2,Excluded,Money In / Refund,Excluded,Business/Main,Reversal of General Account Hold,Completed,2025-12-28,2025-12,December,12
12/28/2025,,2.42,Excluded,Money In / Refund,Excluded,Business/Main,Debit Card Cash Back Bonus,Completed,2025-12-28,2025-12,December,12
12/28/2025,PayPal,-2.17,Excluded,Non-Finalized (Status: Pending),Excluded,Business/Main,Account Hold for Open Authorization,Pending,2025-12-28,2025-12,December,12
12/28/2025,APPLE.COM/BILL,-2.17,Excluded,Non-Finalized (Status: Pending),Excluded,Business/Main,General Authorization,Pending,2025-12-28,2025-12,December,12
12/28/2025,PayPal,-7.8,Excluded,Non-Finalized (Status: Pending),Excluded,Business/Main,Account Hold for Open Authorization,Pending,2025-12-28,2025-12,December,12
12/27/2025,APPLE.COM/BILL,-16.31,Included (True Spend),,Tech & Subs,Business/Main,General PayPal Debit Card Transaction,Completed,2025-12-27,2025-12,December,12
12/27/2025,Farfetch.c,-166.96,Excluded,Non-Finalized (Status: Reversed),Excluded,Business/Main,Void of Authorization,Reversed,2025-12-27,2025-12,December,12
12/27/2025,PayPal Inc.,-166.96,Included (True Spend),,Financial Services,Business/Main,Other,Completed,2025-12-27,2025-12,December,12
12/27/2025,PayPal,-28.2,Excluded,Non-Finalized (Status: Pending),Excluded,Business/Main,Account Hold for Open Authorization,Pending,2025-12-27,2025-12,December,12
12/27/2025,WONDER,-28.2,Excluded,Non-Finalized (Status: Pending),Excluded,Business/Main,General Authorization,Pending,2025-12-27,2025-12,December,12
12/27/2025,PayPal,-20.8,Excluded,Non-Finalized (Status: Pending),Excluded,Business/Main,Account Hold for Open Authorization,Pending,2025-12-27,2025-12,December,12
12/27/2025,T & T Organic Market I,-20.8,Excluded,Non-Finalized (Status: Pending),Excluded,Business/Main,General Authorization,Pending,2025-12-27,2025-12,December,12
12/27/2025,APPLE.COM/BILL,-16.31,Excluded,Non-Finalized (Status: Pending),Excluded,Business/Main,General Authorization,Pending,2025-12-27,2025-12,December,12
12/27/2025,PayPal,-16.31,Excluded,Non-Finalized (Status: Pending),Excluded,Business/Main,Account Hold for Open Authorization,Pending,2025-12-27,2025-12,December,12
12/27/2025,,1.93,Excluded,Non-Finalized (Status: Denied),Excluded,Personal,General Card Deposit,Denied,2025-12-27,2025-12,December,12
12/27/2025,,2.17,Excluded,Non-Finalized (Status: Denied),Excluded,Personal,General Card Deposit,Denied,2025-12-27,2025-12,December,12
12/27/2025,,12.75,Excluded,Non-Finalized (Status: Denied),Excluded,Personal,General Card Deposit,Denied,2025-12-27,2025-12,December,12
12/27/2025,,12.99,Excluded,Non-Finalized (Status: Denied),Excluded,Personal,General Card Deposit,Denied,2025-12-27,2025-12,December,12
12/27/2025,PayPal,16.31,Excluded,Money In / Refund,Excluded,Business/Main,Reversal of General Account Hold,Completed,2025-12-27,2025-12,December,12
12/27/2025,PayPal,166.96,Excluded,Money In / Refund,Excluded,Business/Main,Reversal of General Account Hold,Completed,2025-12-27,2025-12,December,12
12/27/2025,PayPal Inc.,0.0,Included (True Spend),,Financial Services,Personal,Other,Completed,2025-12-27,2025-12,December,12
12/26/2025,1037 NOSTRAND DELI LLC,-2.08,Included (True Spend),,Grocery/Daily,Business/Main,General PayPal Debit Card Transaction,Completed,2025-12-26,2025-12,December,12
12/26/2025,WONDER,-9.37,Excluded,Non-Finalized (Status: Pending),Excluded,Business/Main,General Authorization,Pending,2025-12-26,2025-12,December,12
12/26/2025,CURB MOBILITY,-28.44,Included (True Spend),,Transportation,Business/Main,General PayPal Debit Card Transaction,Completed,2025-12-26,2025-12,December,12
12/26/2025,1037 NOSTRAND DELI LLC,-2.6,Included (True Spend),,Grocery/Daily,Business/Main,General PayPal Debit Card Transaction,Completed,2025-12-26,2025-12,December,12
12/26/2025,WONDER,-9.37,Included (True Spend),,Dining/Restaurants,Business/Main,General PayPal Debit Card Transaction,Completed,2025-12-26,2025-12,December,12
12/26/2025,HERCULES CORP KIOSK,-10.0,Included (True Spend),,Services/Laundry,Personal,General PayPal Debit Card Transaction,Completed,2025-12-26,2025-12,December,12
12/26/2025,PayPal,-9.37,Excluded,Non-Finalized (Status: Pending),Excluded,Business/Main,Account Hold for Open Authorization,Pending,2025-12-26,2025-12,December,12
12/26/2025,Apple Services,-9.99,Included (True Spend),,Tech & Subs,Personal,PreApproved Payment Bill User Payment,Completed,2025-12-26,2025-12,December,12
12/26/2025,HERCULES CORP KIOSK,-10.0,Included (True Spend),,Services/Laundry,Personal,General Authorization,Completed,2025-12-26,2025-12,December,12
12/26/2025,CURB MOBILITY,-28.44,Included (True Spend),,Transportation,Business/Main,General Authorization,Completed,2025-12-26,2025-12,December,12
12/26/2025,1037 NOSTRAND DELI LLC,-2.6,Included (True Spend),,Grocery/Daily,Business/Main,General Authorization,Completed,2025-12-26,2025-12,December,12
12/26/2025,,1.93,Excluded,Non-Finalized (Status: Denied),Excluded,Personal,General Card Deposit,Denied,2025-12-26,2025-12,December,12
12/26/2025,1037 NOSTRAND DELI LLC,-2.08,Included (True Spend),,Grocery/Daily,Business/Main,General Authorization,Completed,2025-12-26,2025-12,December,12
12/26/2025,PayPal Inc.,0.0,Included (True Spend),,Financial Services,Business/Main,Other,Completed,2025-12-26,2025-12,December,12
12/26/2025,PayPal,2.08,Excluded,Money In / Refund,Excluded,Business/Main,Reversal of General Account Hold,Completed,2025-12-26,2025-12,December,12
12/26/2025,,2.17,Excluded,Non-Finalized (Status: Denied),Excluded,Personal,General Card Deposit,Denied,2025-12-26,2025-12,December,12
12/26/2025,PayPal,2.6,Excluded,Money In / Refund,Excluded,Business/Main,Reversal of General Account Hold,Completed,2025-12-26,2025-12,December,12
12/26/2025,PayPal,9.37,Excluded,Money In / Refund,Excluded,Business/Main,Reversal of General Account Hold,Completed,2025-12-26,2025-12,December,12
12/26/2025,PayPal,10.0,Excluded,Money In / Refund,Excluded,Personal,Reversal of General Account Hold,Completed,2025-12-26,2025-12,December,12
12/26/2025,,12.75,Excluded,Non-Finalized (Status: Denied),Excluded,Personal,General Card Deposit,Denied,2025-12-26,2025-12,December,12
12/26/2025,,12.99,Excluded,Non-Finalized (Status: Denied),Excluded,Personal,General Card Deposit,Denied,2025-12-26,2025-12,December,12
12/26/2025,PayPal,28.44,Excluded,Money In / Refund,Excluded,Business/Main,Reversal of General Account Hold,Completed,2025-12-26,2025-12,December,12
12/25/2025,PayPal,-17.3,Excluded,Non-Finalized (Status: Pending),Excluded,Business/Main,Account Hold for Open Authorization,Pending,2025-12-25,2025-12,December,12
12/25/2025,Uber Eats,-17.3,Included (True Spend),,Transportation,Business/Main,PreApproved Payment Bill User Payment,Completed,2025-12-25,2025-12,December,12
12/25/2025,Aizihaer Tuerxuntuoheti,-15.0,Excluded,Transfer / Noise,Excluded,Business/Main,Mobile Payment,Completed,2025-12-25,2025-12,December,12
12/25/2025,HERCULES CORP KIOSK,-10.0,Excluded,Non-Finalized (Status: Pending),Excluded,Personal,General Authorization,Pending,2025-12-25,2025-12,December,12
12/25/2025,PayPal,-10.0,Excluded,Non-Finalized (Status: Pending),Excluded,Personal,Account Hold for Open Authorization,Pending,2025-12-25,2025-12,December,12
12/25/2025,1037 NOSTRAND DELI LLC,-2.08,Excluded,Non-Finalized (Status: Pending),Excluded,Business/Main,General Authorization,Pending,2025-12-25,2025-12,December,12
12/25/2025,PayPal,-2.08,Excluded,Non-Finalized (Status: Pending),Excluded,Business/Main,Account Hold for Open Authorization,Pending,2025-12-25,2025-12,December,12
12/25/2025,,2.76,Excluded,Non-Finalized (Status: Denied),Excluded,Personal,General Card Deposit,Denied,2025-12-25,2025-12,December,12
12/25/2025,,12.99,Excluded,Non-Finalized (Status: Denied),Excluded,Personal,General Card Deposit,Denied,2025-12-25,2025-12,December,12
12/25/2025,REB NYC,15.0,Excluded,Money In / Refund,Excluded,Personal,Mobile Payment,Completed,2025-12-25,2025-12,December,12
12/25/2025,PayPal,17.3,Excluded,Money In / Refund,Excluded,Business/Main,Reversal of General Account Hold,Completed,2025-12-25,2025-12,December,12
12/24/2025,PayPal,-2.6,Excluded,Non-Finalized (Status: Pending),Excluded,Business/Main,Account Hold for Open Authorization,Pending,2025-12-24,2025-12,December,12
12/24/2025,CURB MOBILITY,-28.44,Excluded,Non-Finalized (Status: Pending),Excluded,Business/Main,General Authorization,Pending,2025-12-24,2025-12,December,12
12/24/2025,PayPal,-28.44,Excluded,Non-Finalized (Status: Pending),Excluded,Business/Main,Account Hold for Open Authorization,Pending,2025-12-24,2025-12,December,12
12/24/2025,PayPal,-28.2,Excluded,Non-Finalized (Status: Pending),Excluded,Business/Main,Account Hold for Open Authorization,Pending,2025-12-24,2025-12,December,12
12/24/2025,WONDER,-28.2,Excluded,Non-Finalized (Status: Pending),Excluded,Business/Main,General Authorization,Pending,2025-12-24,2025-12,December,12
12/24/2025,PayPal,-27.11,Excluded,Non-Finalized (Status: Pending),Excluded,Business/Main,Account Hold for Open Authorization,Pending,2025-12-24,2025-12,December,12
12/24/2025,WONDER,-27.11,Excluded,Non-Finalized (Status: Pending),Excluded,Business/Main,General Authorization,Pending,2025-12-24,2025-12,December,12
12/24/2025,WONDER,-27.11,Included (True Spend),,Dining/Restaurants,Business/Main,General PayPal Debit Card Transaction,Completed,2025-12-24,2025-12,December,12
12/24/2025,"Uber Technologies, Inc",-26.44,Included (True Spend),,Transportation,Business/Main,PreApproved Payment Bill User Payment,Completed,2025-12-24,2025-12,December,12
12/24/2025,"Uber Technologies, Inc",-23.94,Excluded,Non-Finalized (Status: Pending),Excluded,Business/Main,General Authorization,Pending,2025-12-24,2025-12,December,12
12/24/2025,1037 NOSTRAND DELI LLC,-2.6,Excluded,Non-Finalized (Status: Pending),Excluded,Business/Main,General Authorization,Pending,2025-12-24,2025-12,December,12
12/24/2025,PayPal,-23.94,Excluded,Non-Finalized (Status: Pending),Excluded,Business/Main,Account Hold for Open Authorization,Pending,2025-12-24,2025-12,December,12
12/24/2025,PayPal,-2.12,Excluded,Non-Finalized (Status: Pending),Excluded,Business/Main,Account Hold for Open Authorization,Pending,2025-12-24,2025-12,December,12
12/24/2025,,12.99,Excluded,Non-Finalized (Status: Denied),Excluded,Personal,General Card Deposit,Denied,2025-12-24,2025-12,December,12
12/24/2025,PayPal,28.2,Excluded,Money In / Refund,Excluded,Business/Main,Reversal of General Account Hold,Completed,2025-12-24,2025-12,December,12
12/24/2025,PayPal,27.11,Excluded,Money In / Refund,Excluded,Business/Main,Reversal of General Account Hold,Completed,2025-12-24,2025-12,December,12
12/24/2025,PayPal,23.94,Excluded,Money In / Refund,Excluded,Business/Main,Reversal of General Account Hold,Completed,2025-12-24,2025-12,December,12
12/24/2025,MARBLE,49.0,Excluded,Money In / Refund,Excluded,Business/Main,General PayPal Debit Card Transaction,Completed,2025-12-24,2025-12,December,12
12/24/2025,,7.76,Excluded,Non-Finalized (Status: Denied),Excluded,Personal,General Card Deposit,Denied,2025-12-24,2025-12,December,12
12/24/2025,PayPal,2.12,Excluded,Money In / Refund,Excluded,Business/Main,Reversal of General Account Hold,Completed,2025-12-24,2025-12,December,12
12/24/2025,WONDER,-2.12,Included (True Spend),,Dining/Restaurants,Business/Main,General PayPal Debit Card Transaction,Completed,2025-12-24,2025-12,December,12
12/24/2025,WONDER,-2.12,Excluded,Non-Finalized (Status: Pending),Excluded,Business/Main,ReAuthorization,Pending,2025-12-24,2025-12,December,12
12/23/2025,PayPal,-8.86,Excluded,Non-Finalized (Status: Pending),Excluded,Business/Main,Account Hold for Open Authorization,Pending,2025-12-23,2025-12,December,12
12/23/2025,PayPal,-70.59,Excluded,Non-Finalized (Status: Pending),Excluded,Business/Main,Account Hold for Open Authorization,Pending,2025-12-23,2025-12,December,12
12/23/2025,TARGET.COM,-70.59,Excluded,Non-Finalized (Status: Pending),Excluded,Business/Main,General Authorization,Pending,2025-12-23,2025-12,December,12
12/23/2025,TARGET.COM,-61.73,Included (True Spend),,Grocery/Daily,Business/Main,General PayPal Debit Card Transaction,Completed,2025-12-23,2025-12,December,12
12/23/2025,SPK*SPOKEO SEARCH,-29.95,Included (True Spend),,Tech & Subs,Business/Main,General PayPal Debit Card Transaction,Completed,2025-12-23,2025-12,December,12
12/23/2025,SPK*SPOKEO SEARCH,-29.95,Included (True Spend),,Tech & Subs,Business/Main,General Authorization,Completed,2025-12-23,2025-12,December,12
12/23/2025,T & T Organic Market I,-18.72,Included (True Spend),,Grocery/Daily,Personal,General PayPal Debit Card Transaction,Completed,2025-12-23,2025-12,December,12
12/23/2025,T & T Organic Market I,-18.72,Included (True Spend),,Grocery/Daily,Personal,General Authorization,Completed,2025-12-23,2025-12,December,12
12/23/2025,WONDER,-12.9,Included (True Spend),,Dining/Restaurants,Business/Main,General PayPal Debit Card Transaction,Completed,2025-12-23,2025-12,December,12
12/23/2025,WONDER,-12.9,Included (True Spend),,Dining/Restaurants,Business/Main,General Authorization,Completed,2025-12-23,2025-12,December,12
12/23/2025,,7.76,Excluded,Non-Finalized (Status: Denied),Excluded,Personal,General Card Deposit,Denied,2025-12-23,2025-12,December,12
12/23/2025,PayPal,70.59,Excluded,Money In / Refund,Excluded,Business/Main,Reversal of General Account Hold,Completed,2025-12-23,2025-12,December,12
12/23/2025,PayPal,12.9,Excluded,Money In / Refund,Excluded,Business/Main,Reversal of General Account Hold,Completed,2025-12-23,2025-12,December,12
12/23/2025,,12.99,Excluded,Non-Finalized (Status: Denied),Excluded,Personal,General Card Deposit,Denied,2025-12-23,2025-12,December,12
12/23/2025,,16.31,Excluded,Non-Finalized (Status: Denied),Excluded,Personal,General Card Deposit,Denied,2025-12-23,2025-12,December,12
12/23/2025,PayPal,18.72,Excluded,Money In / Refund,Excluded,Personal,Reversal of General Account Hold,Completed,2025-12-23,2025-12,December,12
12/23/2025,PayPal,29.95,Excluded,Money In / Refund,Excluded,Business/Main,Reversal of General Account Hold,Completed,2025-12-23,2025-12,December,12
12/23/2025,MARBLE,49.0,Excluded,Non-Finalized (Status: Pending),Excluded,Business/Main,General PayPal Debit Card Transaction,Pending,2025-12-23,2025-12,December,12
12/23/2025,,11.08,Excluded,Non-Finalized (Status: Denied),Excluded,Personal,General Card Deposit,Denied,2025-12-23,2025-12,December,12
12/22/2025,1037 NOSTRAND DELI LLC,-18.72,Included (True Spend),,Grocery/Daily,Personal,General Authorization,Completed,2025-12-22,2025-12,December,12
12/22/2025,PayPal,-16.61,Excluded,Non-Finalized (Status: Pending),Excluded,Business/Main,Account Hold for Open Authorization,Pending,2025-12-22,2025-12,December,12
12/22/2025,T & T Organic Market I,-18.72,Excluded,Non-Finalized (Status: Pending),Excluded,Personal,General Authorization,Pending,2025-12-22,2025-12,December,12
12/22/2025,PayPal,-18.72,Excluded,Non-Finalized (Status: Pending),Excluded,Personal,Account Hold for Open Authorization,Pending,2025-12-22,2025-12,December,12
12/22/2025,PayPal,-12.9,Excluded,Non-Finalized (Status: Pending),Excluded,Business/Main,Account Hold for Open Authorization,Pending,2025-12-22,2025-12,December,12
12/22/2025,1037 NOSTRAND DELI LLC,-18.72,Included (True Spend),,Grocery/Daily,Personal,General PayPal Debit Card Transaction,Completed,2025-12-22,2025-12,December,12
12/22/2025,SPK*SPOKEO SEARCH,-29.95,Excluded,Non-Finalized (Status: Pending),Excluded,Business/Main,General Authorization,Pending,2025-12-22,2025-12,December,12
12/22/2025,PayPal,-29.95,Excluded,Non-Finalized (Status: Pending),Excluded,Business/Main,Account Hold for Open Authorization,Pending,2025-12-22,2025-12,December,12
12/22/2025,Uber Eats,-16.61,Included (True Spend),,Transportation,Business/Main,PreApproved Payment Bill User Payment,Completed,2025-12-22,2025-12,December,12
12/22/2025,WONDER,-12.9,Excluded,Non-Finalized (Status: Pending),Excluded,Business/Main,General Authorization,Pending,2025-12-22,2025-12,December,12
12/22/2025,TARGET.COM,-11.97,Excluded,Non-Finalized (Status: Pending),Excluded,Business/Main,General Authorization,Pending,2025-12-22,2025-12,December,12
12/22/2025,TARGET.COM,-11.97,Included (True Spend),,Grocery/Daily,Business/Main,General PayPal Debit Card Transaction,Completed,2025-12-22,2025-12,December,12
12/22/2025,PayPal Inc.,0.0,Included (True Spend),,Financial Services,Business/Main,Other,Completed,2025-12-22,2025-12,December,12
12/22/2025,PayPal,11.97,Excluded,Money In / Refund,Excluded,Business/Main,Reversal of General Account Hold,Completed,2025-12-22,2025-12,December,12
12/22/2025,PayPal,16.61,Excluded,Money In / Refund,Excluded,Business/Main,Reversal of General Account Hold,Completed,2025-12-22,2025-12,December,12
12/22/2025,PayPal,18.72,Excluded,Money In / Refund,Excluded,Personal,Reversal of General Account Hold,Completed,2025-12-22,2025-12,December,12
12/22/2025,PayPal,-11.97,Excluded,Non-Finalized (Status: Pending),Excluded,Business/Main,Account Hold for Open Authorization,Pending,2025-12-22,2025-12,December,12
12/21/2025,1037 NOSTRAND DELI LLC,-18.72,Excluded,Non-Finalized (Status: Pending),Excluded,Personal,General Authorization,Pending,2025-12-21,2025-12,December,12
12/21/2025,PayPal Inc.,-8.22,Included (True Spend),,Financial Services,Business/Main,Other,Completed,2025-12-21,2025-12,December,12
12/21/2025,TARGET.COM,-44.11,Excluded,Non-Finalized (Status: Reversed),Excluded,Business/Main,Void of Authorization,Reversed,2025-12-21,2025-12,December,12
12/21/2025,PayPal,-38.43,Excluded,Non-Finalized (Status: Pending),Excluded,Business/Main,Account Hold for Open Authorization,Pending,2025-12-21,2025-12,December,12
12/21/2025,WONDER,-38.43,Excluded,Non-Finalized (Status: Pending),Excluded,Business/Main,General Authorization,Pending,2025-12-21,2025-12,December,12
12/21/2025,WONDER,-38.43,Included (True Spend),,Dining/Restaurants,Business/Main,General PayPal Debit Card Transaction,Completed,2025-12-21,2025-12,December,12
12/21/2025,"DoorDash, Inc.",-26.34,Included (True Spend),,Delivery,Business/Main,PreApproved Payment Bill User Payment,Completed,2025-12-21,2025-12,December,12
12/21/2025,PayPal,-18.72,Excluded,Non-Finalized (Status: Pending),Excluded,Personal,Account Hold for Open Authorization,Pending,2025-12-21,2025-12,December,12
12/21/2025,APPLE.COM/BILL,-7.61,Included (True Spend),,Tech & Subs,Personal,General PayPal Debit Card Transaction,Completed,2025-12-21,2025-12,December,12
12/21/2025,APPLE.COM/BILL,-7.61,Included (True Spend),,Tech & Subs,Personal,General Authorization,Completed,2025-12-21,2025-12,December,12
12/21/2025,PayPal,7.61,Excluded,Money In / Refund,Excluded,Personal,Reversal of General Account Hold,Completed,2025-12-21,2025-12,December,12
12/21/2025,PayPal,8.22,Excluded,Money In / Refund,Excluded,Business/Main,Reversal of General Account Hold,Completed,2025-12-21,2025-12,December,12
12/21/2025,,8.34,Excluded,Money In / Refund,Excluded,Business/Main,Debit Card Cash Back Bonus,Completed,2025-12-21,2025-12,December,12
12/21/2025,PayPal,26.34,Excluded,Money In / Refund,Excluded,Business/Main,Reversal of General Account Hold,Completed,2025-12-21,2025-12,December,12
12/21/2025,PayPal,38.43,Excluded,Money In / Refund,Excluded,Business/Main,Reversal of General Account Hold,Completed,2025-12-21,2025-12,December,12
12/20/2025,Aizihaer Tuerxuntuoheti,-50.0,Excluded,Transfer / Noise,Excluded,Business/Main,General Payment,Completed,2025-12-20,2025-12,December,12
12/20/2025,DROPBOX*4RB2HZLGJN46,-19.99,Excluded,Non-Finalized (Status: Pending),Excluded,Business/Main,General Authorization,Pending,2025-12-20,2025-12,December,12
12/20/2025,PayPal,-26.34,Excluded,Non-Finalized (Status: Pending),Excluded,Business/Main,Account Hold for Open Authorization,Pending,2025-12-20,2025-12,December,12
12/20/2025,"DoorDash, Inc.",-26.34,Excluded,Non-Finalized (Status: Pending),Excluded,Business/Main,General Authorization,Pending,2025-12-20,2025-12,December,12
12/20/2025,MARBLE,-49.0,Included (True Spend),,Other/Uncategorized,Business/Main,General Authorization,Completed,2025-12-20,2025-12,December,12
12/20/2025,MARBLE,-49.0,Included (True Spend),,Other/Uncategorized,Business/Main,General PayPal Debit Card Transaction,Completed,2025-12-20,2025-12,December,12
12/20/2025,PayPal,-19.99,Excluded,Non-Finalized (Status: Pending),Excluded,Business/Main,Account Hold for Open Authorization,Pending,2025-12-20,2025-12,December,12
12/20/2025,Farfetch.c,-166.96,Excluded,Non-Finalized (Status: Pending),Excluded,Business/Main,General Authorization,Pending,2025-12-20,2025-12,December,12
12/20/2025,APPLE STORE #R594,-107.79,Included (True Spend),,Tech & Subs,Business/Main,General Authorization,Completed,2025-12-20,2025-12,December,12
12/20/2025,APPLE STORE #R594,-107.79,Included (True Spend),,Tech & Subs,Business/Main,General PayPal Debit Card Transaction,Completed,2025-12-20,2025-12,December,12
12/20/2025,PayPal,-166.96,Excluded,Non-Finalized (Status: Pending),Excluded,Business/Main,Account Hold for Open Authorization,Pending,2025-12-20,2025-12,December,12
12/20/2025,Farfetch.c,-166.96,Included (True Spend),,Other/Uncategorized,Business/Main,General PayPal Debit Card Transaction,Completed,2025-12-20,2025-12,December,12
12/20/2025,DROPBOX*4RB2HZLGJN46,-19.99,Included (True Spend),,Tech & Subs,Business/Main,General PayPal Debit Card Transaction,Completed,2025-12-20,2025-12,December,12
12/20/2025,PayPal,49.0,Excluded,Money In / Refund,Excluded,Business/Main,Reversal of General Account Hold,Completed,2025-12-20,2025-12,December,12
12/20/2025,AMAZON.COM*YE4FR6QQ3,-8.58,Included (True Spend),,Other/Uncategorized,Business/Main,General PayPal Debit Card Transaction,Completed,2025-12-20,2025-12,December,12
12/20/2025,PayPal,19.99,Excluded,Money In / Refund,Excluded,Business/Main,Reversal of General Account Hold,Completed,2025-12-20,2025-12,December,12
12/20/2025,APPLE.COM/BILL,-7.61,Excluded,Non-Finalized (Status: Pending),Excluded,Personal,General Authorization,Pending,2025-12-20,2025-12,December,12
12/20/2025,PayPal,107.79,Excluded,Money In / Refund,Excluded,Business/Main,Reversal of General Account Hold,Completed,2025-12-20,2025-12,December,12
12/20/2025,REB NYC,50.0,Excluded,Non-Finalized (Status: Canceled),Excluded,Personal,Request Received,Canceled,2025-12-20,2025-12,December,12
12/20/2025,Aizihaer   Tuerxuntuoheti,50.0,Excluded,Non-Finalized (Status: Canceled),Excluded,Business/Main,Request Sent,Canceled,2025-12-20,2025-12,December,12
12/20/2025,REB NYC,50.0,Excluded,Money In / Refund,Excluded,Personal,General Payment,Completed,2025-12-20,2025-12,December,12
12/20/2025,PayPal,3.39,Excluded,Money In / Refund,Excluded,Business/Main,Reversal of General Account Hold,Completed,2025-12-20,2025-12,December,12
12/20/2025,PayPal Inc.,0.0,Included (True Spend),,Financial Services,Personal,Other,Completed,2025-12-20,2025-12,December,12
12/20/2025,DM 561,-3.39,Included (True Spend),,Other/Uncategorized,Business/Main,General Authorization,Completed,2025-12-20,2025-12,December,12
12/20/2025,DM 561,-3.39,Included (True Spend),,Other/Uncategorized,Business/Main,General PayPal Debit Card Transaction,Completed,2025-12-20,2025-12,December,12
12/20/2025,PayPal,-7.61,Excluded,Non-Finalized (Status: Pending),Excluded,Personal,Account Hold for Open Authorization,Pending,2025-12-20,2025-12,December,12
12/19/2025,AMAZON.COM*DF4C25N63,-24.97,Included (True Spend),,Other/Uncategorized,Business/Main,General PayPal Debit Card Transaction,Completed,2025-12-19,2025-12,December,12
12/19/2025,PayPal,-107.79,Excluded,Non-Finalized (Status: Pending),Excluded,Business/Main,Account Hold for Open Authorization,Pending,2025-12-19,2025-12,December,12
12/19/2025,BEST BUY MOBILE #2518-s06,-82.61,Included (True Spend),,Transportation,Business/Main,General PayPal Debit Card Transaction,Completed,2025-12-19,2025-12,December,12
12/19/2025,MARBLE,-49.0,Excluded,Non-Finalized (Status: Pending),Excluded,Business/Main,General Authorization,Pending,2025-12-19,2025-12,December,12
12/19/2025,PayPal,-49.0,Excluded,Non-Finalized (Status: Pending),Excluded,Business/Main,Account Hold for Open Authorization,Pending,2025-12-19,2025-12,December,12
12/19/2025,"Uber Technologies, Inc",-29.03,Included (True Spend),,Transportation,Business/Main,PreApproved Payment Bill User Payment,Completed,2025-12-19,2025-12,December,12
12/19/2025,PayPal,-28.47,Excluded,Non-Finalized (Status: Pending),Excluded,Business/Main,Account Hold for Open Authorization,Pending,2025-12-19,2025-12,December,12
12/19/2025,"Uber Technologies, Inc",-28.47,Excluded,Non-Finalized (Status: Pending),Excluded,Business/Main,General Authorization,Pending,2025-12-19,2025-12,December,12
12/19/2025,APPLE STORE #R594,-107.79,Excluded,Non-Finalized (Status: Pending),Excluded,Business/Main,General Authorization,Pending,2025-12-19,2025-12,December,12
12/19/2025,PayPal,-9.97,Excluded,Non-Finalized (Status: Pending),Excluded,Business/Main,Account Hold for Open Authorization,Pending,2025-12-19,2025-12,December,12
12/19/2025,"Uber Technologies, Inc",-8.23,Included (True Spend),,Transportation,Business/Main,PreApproved Payment Bill User Payment,Completed,2025-12-19,2025-12,December,12
12/19/2025,DM 561,-3.39,Excluded,Non-Finalized (Status: Pending),Excluded,Business/Main,General Authorization,Pending,2025-12-19,2025-12,December,12
12/19/2025,PayPal,-3.39,Excluded,Non-Finalized (Status: Pending),Excluded,Business/Main,Account Hold for Open Authorization,Pending,2025-12-19,2025-12,December,12
12/19/2025,PayPal,9.97,Excluded,Money In / Refund,Excluded,Business/Main,Reversal of General Account Hold,Completed,2025-12-19,2025-12,December,12
12/19/2025,PayPal,28.47,Excluded,Money In / Refund,Excluded,Business/Main,Reversal of General Account Hold,Completed,2025-12-19,2025-12,December,12
12/19/2025,"Uber Technologies, Inc",-9.97,Excluded,Non-Finalized (Status: Pending),Excluded,Business/Main,General Authorization,Pending,2025-12-19,2025-12,December,12
12/17/2025,crownbill.com,-17.99,Included (True Spend),,Other/Uncategorized,Business/Main,General Authorization,Completed,2025-12-17,2025-12,December,12
12/17/2025,APPLE STORE #R594,-162.22,Included (True Spend),,Tech & Subs,Business/Main,General PayPal Debit Card Transaction,Completed,2025-12-17,2025-12,December,12
12/17/2025,APPLE STORE #R594,-162.22,Included (True Spend),,Tech & Subs,Business/Main,General Authorization,Completed,2025-12-17,2025-12,December,12
12/17/2025,CASH APP*AIZIHAER TUER,-100.0,Excluded,Non-Finalized (Status: Pending),Excluded,Business/Main,General Authorization,Pending,2025-12-17,2025-12,December,12
12/17/2025,CASH APP*AIZIHAER TUER,-100.0,Excluded,Transfer / Noise,Excluded,Business/Main,General PayPal Debit Card Transaction,Completed,2025-12-17,2025-12,December,12
12/17/2025,PayPal,-100.0,Excluded,Non-Finalized (Status: Pending),Excluded,Business/Main,Account Hold for Open Authorization,Pending,2025-12-17,2025-12,December,12
12/17/2025,TST*XIAN FAMOUS FOODS,-19.71,Included (True Spend),,Dining/Restaurants,Business/Main,General Authorization,Completed,2025-12-17,2025-12,December,12
12/17/2025,crownbill.com,-17.99,Included (True Spend),,Other/Uncategorized,Business/Main,General PayPal Debit Card Transaction,Completed,2025-12-17,2025-12,December,12
12/17/2025,TST*XIAN FAMOUS FOODS,-19.71,Included (True Spend),,Dining/Restaurants,Business/Main,General PayPal Debit Card Transaction,Completed,2025-12-17,2025-12,December,12
12/17/2025,JOES BUSY CORNER,-10.92,Included (True Spend),,Other/Uncategorized,Business/Main,General PayPal Debit Card Transaction,Completed,2025-12-17,2025-12,December,12
12/17/2025,PayPal,10.92,Excluded,Money In / Refund,Excluded,Business/Main,Reversal of General Account Hold,Completed,2025-12-17,2025-12,December,12
12/17/2025,PayPal,18.44,Excluded,Money In / Refund,Excluded,Business/Main,Reversal of General Account Hold,Completed,2025-12-17,2025-12,December,12
12/17/2025,PayPal,19.71,Excluded,Money In / Refund,Excluded,Business/Main,Reversal of General Account Hold,Completed,2025-12-17,2025-12,December,12
12/17/2025,PayPal,100.0,Excluded,Money In / Refund,Excluded,Business/Main,Reversal of General Account Hold,Completed,2025-12-17,2025-12,December,12
12/17/2025,PayPal,162.22,Excluded,Money In / Refund,Excluded,Business/Main,Reversal of General Account Hold,Completed,2025-12-17,2025-12,December,12
12/17/2025,JOES BUSY CORNER,-10.92,Included (True Spend),,Other/Uncategorized,Business/Main,General Authorization,Completed,2025-12-17,2025-12,December,12
12/16/2025,CASH APP*AIZIHAER TUER,-50.0,Excluded,Non-Finalized (Status: Pending),Excluded,Business/Main,General Authorization,Pending,2025-12-16,2025-12,December,12
12/16/2025,Uber Eats,-35.01,Included (True Spend),,Transportation,Business/Main,Other,Completed,2025-12-16,2025-12,December,12
12/16/2025,Uber Eats,-35.01,Excluded,Non-Finalized (Status: Pending),Excluded,Business/Main,General Authorization,Pending,2025-12-16,2025-12,December,12
12/16/2025,PayPal,-35.01,Excluded,Non-Finalized (Status: Pending),Excluded,Business/Main,Account Hold for Open Authorization,Pending,2025-12-16,2025-12,December,12
12/16/2025,PayPal,-50.0,Excluded,Non-Finalized (Status: Pending),Excluded,Business/Main,Account Hold for Open Authorization,Pending,2025-12-16,2025-12,December,12
12/16/2025,CASH APP*AIZIHAER TUER,-50.0,Excluded,Transfer / Noise,Excluded,Business/Main,General PayPal Debit Card Transaction,Completed,2025-12-16,2025-12,December,12
12/16/2025,APPLE STORE #R594,-162.22,Excluded,Non-Finalized (Status: Pending),Excluded,Business/Main,General Authorization,Pending,2025-12-16,2025-12,December,12
12/16/2025,Uber Eats,-52.08,Included (True Spend),,Transportation,Business/Main,PreApproved Payment Bill User Payment,Completed,2025-12-16,2025-12,December,12
12/16/2025,PayPal,-162.22,Excluded,Non-Finalized (Status: Pending),Excluded,Business/Main,Account Hold for Open Authorization,Pending,2025-12-16,2025-12,December,12
12/16/2025,BLOOMINGDALES  .COM,-381.06,Included (True Spend),,Other/Uncategorized,Business/Main,General Authorization,Completed,2025-12-16,2025-12,December,12
12/16/2025,BLOOMINGDALES  .COM,-381.06,Included (True Spend),,Other/Uncategorized,Business/Main,General PayPal Debit Card Transaction,Completed,2025-12-16,2025-12,December,12
12/16/2025,PayPal,-28.93,Excluded,Non-Finalized (Status: Pending),Excluded,Business/Main,Account Hold for Open Authorization,Pending,2025-12-16,2025-12,December,12
12/16/2025,Uber Eats,-35.01,Excluded,Non-Finalized (Status: Reversed),Excluded,Business/Main,Void of Authorization,Reversed,2025-12-16,2025-12,December,12
12/16/2025,PayPal,28.93,Excluded,Money In / Refund,Excluded,Business/Main,Reversal of General Account Hold,Completed,2025-12-16,2025-12,December,12
12/16/2025,"Uber Technologies, Inc",-28.93,Included (True Spend),,Transportation,Business/Main,PreApproved Payment Bill User Payment,Completed,2025-12-16,2025-12,December,12
12/16/2025,,8.4,Excluded,Non-Finalized (Status: Denied),Excluded,Personal,General Card Deposit,Denied,2025-12-16,2025-12,December,12
12/16/2025,PayPal,381.06,Excluded,Money In / Refund,Excluded,Business/Main,Reversal of General Account Hold,Completed,2025-12-16,2025-12,December,12
12/16/2025,PayPal,35.01,Excluded,Money In / Refund,Excluded,Business/Main,Reversal of General Account Hold,Completed,2025-12-16,2025-12,December,12
12/16/2025,PayPal,-19.71,Excluded,Non-Finalized (Status: Pending),Excluded,Business/Main,Account Hold for Open Authorization,Pending,2025-12-16,2025-12,December,12
12/16/2025,,8.68,Excluded,Non-Finalized (Status: Denied),Excluded,Personal,General Card Deposit,Denied,2025-12-16,2025-12,December,12
12/16/2025,PayPal,50.0,Excluded,Money In / Refund,Excluded,Business/Main,Reversal of General Account Hold,Completed,2025-12-16,2025-12,December,12
12/16/2025,PayPal,-10.92,Excluded,Non-Finalized (Status: Pending),Excluded,Business/Main,Account Hold for Open Authorization,Pending,2025-12-16,2025-12,December,12
12/16/2025,JOES BUSY CORNER,-10.92,Excluded,Non-Finalized (Status: Pending),Excluded,Business/Main,General Authorization,Pending,2025-12-16,2025-12,December,12
12/16/2025,crownbill.com,-17.99,Excluded,Non-Finalized (Status: Pending),Excluded,Business/Main,General Authorization,Pending,2025-12-16,2025-12,December,12
12/16/2025,PayPal,-18.44,Excluded,Non-Finalized (Status: Pending),Excluded,Business/Main,Account Hold for Open Authorization,Pending,2025-12-16,2025-12,December,12
12/16/2025,TST*XIAN FAMOUS FOODS,-19.71,Excluded,Non-Finalized (Status: Pending),Excluded,Business/Main,General Authorization,Pending,2025-12-16,2025-12,December,12
12/15/2025,Uber Eats,-34.07,Included (True Spend),,Transportation,Business/Main,PreApproved Payment Bill User Payment,Completed,2025-12-15,2025-12,December,12
12/15/2025,STERLING DELI AND GROC,-17.16,Included (True Spend),,Grocery/Daily,Business/Main,General PayPal Debit Card Transaction,Completed,2025-12-15,2025-12,December,12
12/15/2025,"Uber Technologies, Inc",-25.02,Excluded,Non-Finalized (Status: Reversed),Excluded,Business/Main,Void of Authorization,Reversed,2025-12-15,2025-12,December,12
12/15/2025,"Uber Technologies, Inc",-25.02,Included (True Spend),,Transportation,Business/Main,Other,Completed,2025-12-15,2025-12,December,12
12/15/2025,"Uber Technologies, Inc",-25.02,Excluded,Non-Finalized (Status: Pending),Excluded,Business/Main,General Authorization,Pending,2025-12-15,2025-12,December,12
12/15/2025,PayPal,-25.02,Excluded,Non-Finalized (Status: Pending),Excluded,Business/Main,Account Hold for Open Authorization,Pending,2025-12-15,2025-12,December,12
12/15/2025,"Uber Technologies, Inc",-25.13,Excluded,Non-Finalized (Status: Pending),Excluded,Business/Main,General Authorization,Pending,2025-12-15,2025-12,December,12
12/15/2025,PayPal,-25.13,Excluded,Non-Finalized (Status: Pending),Excluded,Business/Main,Account Hold for Open Authorization,Pending,2025-12-15,2025-12,December,12
12/15/2025,"Uber Technologies, Inc",-26.03,Included (True Spend),,Transportation,Business/Main,PreApproved Payment Bill User Payment,Completed,2025-12-15,2025-12,December,12
12/15/2025,Uber Eats,-32.42,Included (True Spend),,Transportation,Business/Main,PreApproved Payment Bill User Payment,Completed,2025-12-15,2025-12,December,12
12/15/2025,CASH APP*AIZIHAER TUER,-300.0,Excluded,Transfer / Noise,Excluded,Business/Main,General PayPal Debit Card Transaction,Completed,2025-12-15,2025-12,December,12
12/15/2025,PayPal,-34.07,Excluded,Non-Finalized (Status: Pending),Excluded,Business/Main,Account Hold for Open Authorization,Pending,2025-12-15,2025-12,December,12
12/15/2025,TARGET.COM,-35.89,Included (True Spend),,Grocery/Daily,Business/Main,General PayPal Debit Card Transaction,Completed,2025-12-15,2025-12,December,12
12/15/2025,REB NYC,-200.0,Excluded,Transfer / Noise,Excluded,Personal,Mobile Payment,Completed,2025-12-15,2025-12,December,12
12/15/2025,REB NYC,-300.0,Excluded,Transfer / Noise,Excluded,Personal,Mobile Payment,Completed,2025-12-15,2025-12,December,12
12/15/2025,PayPal,-300.0,Excluded,Non-Finalized (Status: Pending),Excluded,Business/Main,Account Hold for Open Authorization,Pending,2025-12-15,2025-12,December,12
12/15/2025,PayPal,-12.17,Excluded,Non-Finalized (Status: Pending),Excluded,Business/Main,Account Hold for Open Authorization,Pending,2025-12-15,2025-12,December,12
12/15/2025,CASH APP*AIZIHAER TUER,-300.0,Excluded,Non-Finalized (Status: Pending),Excluded,Business/Main,General Authorization,Pending,2025-12-15,2025-12,December,12
12/15/2025,PayPal,-381.06,Excluded,Non-Finalized (Status: Pending),Excluded,Business/Main,Account Hold for Open Authorization,Pending,2025-12-15,2025-12,December,12
12/15/2025,BLOOMINGDALES  .COM,-381.06,Excluded,Non-Finalized (Status: Pending),Excluded,Business/Main,General Authorization,Pending,2025-12-15,2025-12,December,12
12/15/2025,STERLING DELI AND GROC,-17.16,Included (True Spend),,Grocery/Daily,Business/Main,General Authorization,Completed,2025-12-15,2025-12,December,12
12/15/2025,"Uber Technologies, Inc",-12.17,Excluded,Non-Finalized (Status: Pending),Excluded,Business/Main,General Authorization,Pending,2025-12-15,2025-12,December,12
12/15/2025,Aizihaer Tuerxuntuoheti,194.02,Excluded,Money In / Refund,Excluded,Business/Main,Mobile Payment,Completed,2025-12-15,2025-12,December,12
12/15/2025,PayPal,25.02,Excluded,Money In / Refund,Excluded,Business/Main,Reversal of General Account Hold,Completed,2025-12-15,2025-12,December,12
12/15/2025,,300.0,Excluded,Money In / Refund,Excluded,Personal,General Card Deposit,Completed,2025-12-15,2025-12,December,12
12/15/2025,PayPal,300.0,Excluded,Money In / Refund,Excluded,Business/Main,Reversal of General Account Hold,Completed,2025-12-15,2025-12,December,12
12/15/2025,Aizihaer Tuerxuntuoheti,291.03,Excluded,Money In / Refund,Excluded,Business/Main,Mobile Payment,Completed,2025-12-15,2025-12,December,12
12/15/2025,,200.0,Excluded,Money In / Refund,Excluded,Personal,General Card Deposit,Completed,2025-12-15,2025-12,December,12
12/15/2025,"Uber Technologies, Inc",-12.15,Included (True Spend),,Transportation,Business/Main,PreApproved Payment Bill User Payment,Completed,2025-12-15,2025-12,December,12
12/15/2025,PayPal,44.11,Excluded,Money In / Refund,Excluded,Business/Main,Reversal of General Account Hold,Completed,2025-12-15,2025-12,December,12
12/15/2025,PayPal,34.07,Excluded,Money In / Refund,Excluded,Business/Main,Reversal of General Account Hold,Completed,2025-12-15,2025-12,December,12
12/15/2025,PayPal,25.13,Excluded,Money In / Refund,Excluded,Business/Main,Reversal of General Account Hold,Completed,2025-12-15,2025-12,December,12
12/15/2025,PayPal,32.42,Excluded,Money In / Refund,Excluded,Business/Main,Reversal of General Account Hold,Completed,2025-12-15,2025-12,December,12
12/15/2025,PayPal,17.16,Excluded,Money In / Refund,Excluded,Business/Main,Reversal of General Account Hold,Completed,2025-12-15,2025-12,December,12
12/15/2025,PayPal,12.17,Excluded,Money In / Refund,Excluded,Business/Main,Reversal of General Account Hold,Completed,2025-12-15,2025-12,December,12
12/15/2025,,8.68,Excluded,Non-Finalized (Status: Denied),Excluded,Personal,General Card Deposit,Denied,2025-12-15,2025-12,December,12
12/15/2025,,8.4,Excluded,Non-Finalized (Status: Denied),Excluded,Personal,General Card Deposit,Denied,2025-12-15,2025-12,December,12
12/15/2025,PayPal,0.95,Excluded,Money In / Refund,Excluded,Business/Main,Reversal of General Account Hold,Completed,2025-12-15,2025-12,December,12
12/15/2025,SPK*SPOKEO SEARCH,-0.95,Included (True Spend),,Tech & Subs,Business/Main,General Authorization,Completed,2025-12-15,2025-12,December,12
12/15/2025,SPK*SPOKEO SEARCH,-0.95,Included (True Spend),,Tech & Subs,Business/Main,General PayPal Debit Card Transaction,Completed,2025-12-15,2025-12,December,12
12/15/2025,PayPal,-8.22,Excluded,Non-Finalized (Status: Pending),Excluded,Business/Main,Account Hold for Open Authorization,Pending,2025-12-15,2025-12,December,12
12/14/2025,PayPal,-34.15,Excluded,Non-Finalized (Status: Pending),Excluded,Business/Main,Account Hold for Open Authorization,Pending,2025-12-14,2025-12,December,12
12/14/2025,PayPal,-25.1,Excluded,Non-Finalized (Status: Pending),Excluded,Business/Main,Account Hold for Open Authorization,Pending,2025-12-14,2025-12,December,12
12/14/2025,Uber Eats,-32.42,Excluded,Non-Finalized (Status: Pending),Excluded,Business/Main,General Authorization,Pending,2025-12-14,2025-12,December,12
12/14/2025,PayPal,-32.42,Excluded,Non-Finalized (Status: Pending),Excluded,Business/Main,Account Hold for Open Authorization,Pending,2025-12-14,2025-12,December,12
12/14/2025,Uber Eats,-34.15,Included (True Spend),,Transportation,Business/Main,PreApproved Payment Bill User Payment,Completed,2025-12-14,2025-12,December,12
12/14/2025,"Uber Technologies, Inc",-25.1,Included (True Spend),,Transportation,Business/Main,Other,Completed,2025-12-14,2025-12,December,12
12/14/2025,TARGET.COM,-44.11,Excluded,Non-Finalized (Status: Pending),Excluded,Business/Main,General Authorization,Pending,2025-12-14,2025-12,December,12
12/14/2025,PayPal,-44.11,Excluded,Non-Finalized (Status: Pending),Excluded,Business/Main,Account Hold for Open Authorization,Pending,2025-12-14,2025-12,December,12
12/14/2025,PayPal,-50.0,Excluded,Non-Finalized (Status: Pending),Excluded,Business/Main,Account Hold for Open Authorization,Pending,2025-12-14,2025-12,December,12
12/14/2025,CASH APP*AIZIHAER TUER,-50.0,Excluded,Transfer / Noise,Excluded,Business/Main,General PayPal Debit Card Transaction,Completed,2025-12-14,2025-12,December,12
12/14/2025,CASH APP*AIZIHAER TUER,-50.0,Excluded,Non-Finalized (Status: Pending),Excluded,Business/Main,General Authorization,Pending,2025-12-14,2025-12,December,12
12/14/2025,"Uber Technologies, Inc",-25.1,Excluded,Non-Finalized (Status: Pending),Excluded,Business/Main,General Authorization,Pending,2025-12-14,2025-12,December,12
12/14/2025,PayPal,34.15,Excluded,Money In / Refund,Excluded,Business/Main,Reversal of General Account Hold,Completed,2025-12-14,2025-12,December,12
12/14/2025,"Uber Technologies, Inc",-25.1,Excluded,Non-Finalized (Status: Reversed),Excluded,Business/Main,Void of Authorization,Reversed,2025-12-14,2025-12,December,12
12/14/2025,AMAZON PRIME PMTS,-8.15,Included (True Spend),,Tech & Subs,Business/Main,General Authorization,Completed,2025-12-14,2025-12,December,12
12/14/2025,PayPal,-0.95,Excluded,Non-Finalized (Status: Pending),Excluded,Business/Main,Account Hold for Open Authorization,Pending,2025-12-14,2025-12,December,12
12/14/2025,SPK*SPOKEO SEARCH,-0.95,Excluded,Non-Finalized (Status: Pending),Excluded,Business/Main,General Authorization,Pending,2025-12-14,2025-12,December,12
12/14/2025,PayPal Inc.,0.0,Included (True Spend),,Financial Services,Business/Main,Other,Completed,2025-12-14,2025-12,December,12
12/14/2025,,3.25,Excluded,Money In / Refund,Excluded,Business/Main,Debit Card Cash Back Bonus,Completed,2025-12-14,2025-12,December,12
12/14/2025,PayPal,8.15,Excluded,Money In / Refund,Excluded,Business/Main,Reversal of General Account Hold,Completed,2025-12-14,2025-12,December,12
12/14/2025,PayPal,25.1,Excluded,Money In / Refund,Excluded,Business/Main,Reversal of General Account Hold,Completed,2025-12-14,2025-12,December,12
12/14/2025,PayPal,50.0,Excluded,Money In / Refund,Excluded,Business/Main,Reversal of General Account Hold,Completed,2025-12-14,2025-12,December,12
12/14/2025,AMAZON PRIME PMTS,-8.15,Included (True Spend),,Tech & Subs,Business/Main,General PayPal Debit Card Transaction,Completed,2025-12-14,2025-12,December,12
12/13/2025,STERLING DELI AND GROC,-17.16,Excluded,Non-Finalized (Status: Pending),Excluded,Business/Main,General Authorization,Pending,2025-12-13,2025-12,December,12
12/13/2025,T & T Organic Market I,-11.96,Included (True Spend),,Grocery/Daily,Business/Main,General PayPal Debit Card Transaction,Completed,2025-12-13,2025-12,December,12
12/13/2025,WONDER,-13.01,Included (True Spend),,Dining/Restaurants,Business/Main,General PayPal Debit Card Transaction,Completed,2025-12-13,2025-12,December,12
12/13/2025,WONDER,-13.01,Excluded,Non-Finalized (Status: Pending),Excluded,Business/Main,General Authorization,Pending,2025-12-13,2025-12,December,12
12/13/2025,PayPal,-13.01,Excluded,Non-Finalized (Status: Pending),Excluded,Business/Main,Account Hold for Open Authorization,Pending,2025-12-13,2025-12,December,12
12/13/2025,PayPal,-37.46,Excluded,Non-Finalized (Status: Pending),Excluded,Business/Main,Account Hold for Open Authorization,Pending,2025-12-13,2025-12,December,12
12/13/2025,PayPal,-17.16,Excluded,Non-Finalized (Status: Pending),Excluded,Business/Main,Account Hold for Open Authorization,Pending,2025-12-13,2025-12,December,12
12/13/2025,WONDER,-27.11,Included (True Spend),,Dining/Restaurants,Business/Main,General Authorization,Completed,2025-12-13,2025-12,December,12
12/13/2025,WONDER,-27.11,Included (True Spend),,Dining/Restaurants,Business/Main,General PayPal Debit Card Transaction,Completed,2025-12-13,2025-12,December,12
12/13/2025,Uber Eats,-37.46,Excluded,Non-Finalized (Status: Pending),Excluded,Business/Main,General Authorization,Pending,2025-12-13,2025-12,December,12
12/13/2025,Uber Eats,-37.47,Included (True Spend),,Transportation,Business/Main,PreApproved Payment Bill User Payment,Completed,2025-12-13,2025-12,December,12
12/13/2025,T & T Organic Market I,-11.96,Included (True Spend),,Grocery/Daily,Business/Main,General Authorization,Completed,2025-12-13,2025-12,December,12
12/13/2025,AMAZON PRIME PMTS,-8.15,Excluded,Non-Finalized (Status: Pending),Excluded,Business/Main,General Authorization,Pending,2025-12-13,2025-12,December,12
12/13/2025,PayPal,-8.15,Excluded,Non-Finalized (Status: Pending),Excluded,Business/Main,Account Hold for Open Authorization,Pending,2025-12-13,2025-12,December,12
12/13/2025,PayPal,6.52,Excluded,Money In / Refund,Excluded,Business/Main,Reversal of General Account Hold,Completed,2025-12-13,2025-12,December,12
12/13/2025,EXXON EMPIRE AUTO REPA,-6.52,Included (True Spend),,Transportation,Business/Main,General PayPal Debit Card Transaction,Completed,2025-12-13,2025-12,December,12
12/13/2025,PayPal,27.11,Excluded,Money In / Refund,Excluded,Business/Main,Reversal of General Account Hold,Completed,2025-12-13,2025-12,December,12
12/13/2025,PayPal,13.01,Excluded,Money In / Refund,Excluded,Business/Main,Reversal of General Account Hold,Completed,2025-12-13,2025-12,December,12
12/13/2025,PayPal,11.96,Excluded,Money In / Refund,Excluded,Business/Main,Reversal of General Account Hold,Completed,2025-12-13,2025-12,December,12
12/13/2025,PayPal,37.46,Excluded,Money In / Refund,Excluded,Business/Main,Reversal of General Account Hold,Completed,2025-12-13,2025-12,December,12
12/13/2025,PayPal,2.9,Excluded,Money In / Refund,Excluded,Business/Main,Reversal of General Account Hold,Completed,2025-12-13,2025-12,December,12
12/13/2025,MTA*NYCT PAYGO,-2.9,Included (True Spend),,Transportation,Business/Main,General Authorization,Completed,2025-12-13,2025-12,December,12
12/13/2025,MTA*NYCT PAYGO,-2.9,Included (True Spend),,Transportation,Business/Main,General PayPal Debit Card Transaction,Completed,2025-12-13,2025-12,December,12
12/13/2025,EXXON EMPIRE AUTO REPA,-6.52,Included (True Spend),,Transportation,Business/Main,General Authorization,Completed,2025-12-13,2025-12,December,12
12/12/2025,MTA*NYCT PAYGO,-2.9,Excluded,Non-Finalized (Status: Pending),Excluded,Business/Main,General Authorization,Pending,2025-12-12,2025-12,December,12
12/12/2025,CASH APP*AIZIHAER TUER,-35.0,Excluded,Non-Finalized (Status: Pending),Excluded,Business/Main,General Authorization,Pending,2025-12-12,2025-12,December,12
12/12/2025,CASH APP*AIZIHAER TUER,-35.0,Excluded,Transfer / Noise,Excluded,Business/Main,General PayPal Debit Card Transaction,Completed,2025-12-12,2025-12,December,12
12/12/2025,PayPal,-35.0,Excluded,Non-Finalized (Status: Pending),Excluded,Business/Main,Account Hold for Open Authorization,Pending,2025-12-12,2025-12,December,12
12/12/2025,PayPal,-27.11,Excluded,Non-Finalized (Status: Pending),Excluded,Business/Main,Account Hold for Open Authorization,Pending,2025-12-12,2025-12,December,12
12/12/2025,WONDER,-27.11,Excluded,Non-Finalized (Status: Pending),Excluded,Business/Main,General Authorization,Pending,2025-12-12,2025-12,December,12
12/12/2025,PayPal,-11.96,Excluded,Non-Finalized (Status: Pending),Excluded,Business/Main,Account Hold for Open Authorization,Pending,2025-12-12,2025-12,December,12
12/12/2025,T & T Organic Market I,-11.96,Excluded,Non-Finalized (Status: Pending),Excluded,Business/Main,General Authorization,Pending,2025-12-12,2025-12,December,12
12/12/2025,EXXON EMPIRE AUTO REPA,-6.52,Excluded,Non-Finalized (Status: Pending),Excluded,Business/Main,General Authorization,Pending,2025-12-12,2025-12,December,12
12/12/2025,PayPal,-6.52,Excluded,Non-Finalized (Status: Pending),Excluded,Business/Main,Account Hold for Open Authorization,Pending,2025-12-12,2025-12,December,12
12/12/2025,REB NYC,-103.0,Excluded,Transfer / Noise,Excluded,Personal,Mobile Payment,Completed,2025-12-12,2025-12,December,12
12/12/2025,PayPal,-2.9,Excluded,Non-Finalized (Status: Pending),Excluded,Business/Main,Account Hold for Open Authorization,Pending,2025-12-12,2025-12,December,12
12/12/2025,PayPal,35.0,Excluded,Money In / Refund,Excluded,Business/Main,Reversal of General Account Hold,Completed,2025-12-12,2025-12,December,12
12/12/2025,CASH APP*AIZIHAER TUER,209.14,Excluded,Money In / Refund,Excluded,Business/Main,General PayPal Debit Card Transaction,Completed,2025-12-12,2025-12,December,12
12/12/2025,,103.0,Excluded,Non-Finalized (Status: Denied),Excluded,Personal,General Card Deposit,Denied,2025-12-12,2025-12,December,12
12/12/2025,Aizihaer Tuerxuntuoheti,99.92,Excluded,Money In / Refund,Excluded,Business/Main,Mobile Payment,Completed,2025-12-12,2025-12,December,12
12/12/2025,PayPal,-2.5,Excluded,Non-Finalized (Status: Pending),Excluded,Business/Main,Account Hold for Open Authorization,Pending,2025-12-12,2025-12,December,12
12/12/2025,PayPal,2.5,Excluded,Money In / Refund,Excluded,Business/Main,Reversal of General Account Hold,Completed,2025-12-12,2025-12,December,12
12/12/2025,SQ *HENA350INC,-2.5,Included (True Spend),,Dining/Restaurants,Business/Main,General PayPal Debit Card Transaction,Completed,2025-12-12,2025-12,December,12
12/12/2025,SQ *HENA350INC,-2.5,Excluded,Non-Finalized (Status: Pending),Excluded,Business/Main,General Authorization,Pending,2025-12-12,2025-12,December,12
12/11/2025,CASH APP*AIZIHAER TUER,-50.0,Excluded,Transfer / Noise,Excluded,Business/Main,General PayPal Debit Card Transaction,Completed,2025-12-11,2025-12,December,12
12/11/2025,CASH APP*AIZIHAER TUER,-124.63,Excluded,Non-Finalized (Status: Pending),Excluded,Business/Main,General Authorization,Pending,2025-12-11,2025-12,December,12
12/11/2025,CASH APP*AIZIHAER TUER,-124.63,Excluded,Transfer / Noise,Excluded,Business/Main,General PayPal Debit Card Transaction,Completed,2025-12-11,2025-12,December,12
12/11/2025,PayPal,-124.63,Excluded,Non-Finalized (Status: Pending),Excluded,Business/Main,Account Hold for Open Authorization,Pending,2025-12-11,2025-12,December,12
12/11/2025,CASH APP*AIZIHAER TUER,-100.0,Excluded,Non-Finalized (Status: Pending),Excluded,Business/Main,General Authorization,Pending,2025-12-11,2025-12,December,12
12/11/2025,CASH APP*AIZIHAER TUER,-100.0,Excluded,Transfer / Noise,Excluded,Business/Main,General PayPal Debit Card Transaction,Completed,2025-12-11,2025-12,December,12
12/11/2025,PayPal,-100.0,Excluded,Non-Finalized (Status: Pending),Excluded,Business/Main,Account Hold for Open Authorization,Pending,2025-12-11,2025-12,December,12
12/11/2025,Aizihaer Tuerxuntuoheti,-50.0,Excluded,Transfer / Noise,Excluded,Business/Main,Mobile Payment,Completed,2025-12-11,2025-12,December,12
12/11/2025,CASH APP*AIZIHAER TUER,-50.0,Excluded,Non-Finalized (Status: Pending),Excluded,Business/Main,General Authorization,Pending,2025-12-11,2025-12,December,12
12/11/2025,WONDER-GRHUB*MEDUSAGRE,-20.69,Included (True Spend),,Dining/Restaurants,Business/Main,General PayPal Debit Card Transaction,Completed,2025-12-11,2025-12,December,12
12/11/2025,PayPal,-50.0,Excluded,Non-Finalized (Status: Pending),Excluded,Business/Main,Account Hold for Open Authorization,Pending,2025-12-11,2025-12,December,12
12/11/2025,WONDER-GRHUB*MEDUSAGRE,-20.69,Included (True Spend),,Dining/Restaurants,Business/Main,General Authorization,Completed,2025-12-11,2025-12,December,12
12/11/2025,PayPal,20.69,Excluded,Money In / Refund,Excluded,Business/Main,Reversal of General Account Hold,Completed,2025-12-11,2025-12,December,12
12/11/2025,PayPal,50.0,Excluded,Money In / Refund,Excluded,Business/Main,Reversal of General Account Hold,Completed,2025-12-11,2025-12,December,12
12/11/2025,REB NYC,50.0,Excluded,Money In / Refund,Excluded,Personal,Mobile Payment,Completed,2025-12-11,2025-12,December,12
12/11/2025,PayPal,100.0,Excluded,Money In / Refund,Excluded,Business/Main,Reversal of General Account Hold,Completed,2025-12-11,2025-12,December,12
12/11/2025,PayPal,124.63,Excluded,Money In / Refund,Excluded,Business/Main,Reversal of General Account Hold,Completed,2025-12-11,2025-12,December,12
12/10/2025,PayPal,-20.69,Excluded,Non-Finalized (Status: Pending),Excluded,Business/Main,Account Hold for Open Authorization,Pending,2025-12-10,2025-12,December,12
12/10/2025,VESTA  *AT&T PREPAID,-36.3,Included (True Spend),,Phone/Utilities,Business/Main,General PayPal Debit Card Transaction,Completed,2025-12-10,2025-12,December,12
12/10/2025,VESTA  *AT&T PREPAID,-36.3,Included (True Spend),,Phone/Utilities,Business/Main,General Authorization,Completed,2025-12-10,2025-12,December,12
12/10/2025,BROWSERTRIX,-30.0,Excluded,Non-Finalized (Status: Pending),Excluded,Business/Main,General Authorization,Pending,2025-12-10,2025-12,December,12
12/10/2025,BROWSERTRIX,-30.0,Included (True Spend),,Other/Uncategorized,Business/Main,General PayPal Debit Card Transaction,Completed,2025-12-10,2025-12,December,12
12/10/2025,PayPal,-30.0,Excluded,Non-Finalized (Status: Pending),Excluded,Business/Main,Account Hold for Open Authorization,Pending,2025-12-10,2025-12,December,12
12/10/2025,PayPal Inc.,0.0,Included (True Spend),,Financial Services,Business/Main,Other,Completed,2025-12-10,2025-12,December,12
12/10/2025,WONDER-GRHUB*MEDUSAGRE,-20.69,Excluded,Non-Finalized (Status: Pending),Excluded,Business/Main,General Authorization,Pending,2025-12-10,2025-12,December,12
12/10/2025,PayPal,30.0,Excluded,Money In / Refund,Excluded,Business/Main,Reversal of General Account Hold,Completed,2025-12-10,2025-12,December,12
12/10/2025,PayPal,36.3,Excluded,Money In / Refund,Excluded,Business/Main,Reversal of General Account Hold,Completed,2025-12-10,2025-12,December,12
12/10/2025,Apple Services,-11.95,Included (True Spend),,Tech & Subs,Personal,PreApproved Payment Bill User Payment,Completed,2025-12-10,2025-12,December,12
12/09/2025,1037 NOSTRAND DELI LLC,-16.12,Included (True Spend),,Grocery/Daily,Personal,General Authorization,Completed,2025-12-09,2025-12,December,12
12/09/2025,TARGET.COM,-60.24,Excluded,Non-Finalized (Status: Reversed),Excluded,Business/Main,Void of Authorization,Reversed,2025-12-09,2025-12,December,12
12/09/2025,"Uber Technologies, Inc",-51.36,Included (True Spend),,Transportation,Business/Main,PreApproved Payment Bill User Payment,Completed,2025-12-09,2025-12,December,12
12/09/2025,PayPal,-44.81,Excluded,Non-Finalized (Status: Pending),Excluded,Business/Main,Account Hold for Open Authorization,Pending,2025-12-09,2025-12,December,12
12/09/2025,"Uber Technologies, Inc",-44.81,Excluded,Non-Finalized (Status: Pending),Excluded,Business/Main,General Authorization,Pending,2025-12-09,2025-12,December,12
12/09/2025,PayPal,-36.3,Excluded,Non-Finalized (Status: Pending),Excluded,Business/Main,Account Hold for Open Authorization,Pending,2025-12-09,2025-12,December,12
12/09/2025,VESTA  *AT&T PREPAID,-36.3,Excluded,Non-Finalized (Status: Pending),Excluded,Business/Main,General Authorization,Pending,2025-12-09,2025-12,December,12
12/09/2025,1037 NOSTRAND DELI LLC,-16.12,Included (True Spend),,Grocery/Daily,Personal,General PayPal Debit Card Transaction,Completed,2025-12-09,2025-12,December,12
12/09/2025,PayPal Inc.,-12.45,Included (True Spend),,Financial Services,Business/Main,Other,Completed,2025-12-09,2025-12,December,12
12/09/2025,PAYPRO *NEKTONY,-8.66,Included (True Spend),,Tech & Subs,Personal,General PayPal Debit Card Transaction,Completed,2025-12-09,2025-12,December,12
12/09/2025,PAYPRO *NEKTONY,-8.66,Included (True Spend),,Tech & Subs,Personal,General Authorization,Completed,2025-12-09,2025-12,December,12
12/09/2025,PayPal,8.66,Excluded,Money In / Refund,Excluded,Personal,Reversal of General Account Hold,Completed,2025-12-09,2025-12,December,12
12/09/2025,PayPal,12.45,Excluded,Money In / Refund,Excluded,Business/Main,Reversal of General Account Hold,Completed,2025-12-09,2025-12,December,12
12/09/2025,PayPal,16.12,Excluded,Money In / Refund,Excluded,Personal,Reversal of General Account Hold,Completed,2025-12-09,2025-12,December,12
12/09/2025,PayPal,44.81,Excluded,Money In / Refund,Excluded,Business/Main,Reversal of General Account Hold,Completed,2025-12-09,2025-12,December,12
12/08/2025,PayPal,-19.41,Excluded,Non-Finalized (Status: Pending),Excluded,Business/Main,Account Hold for Open Authorization,Pending,2025-12-08,2025-12,December,12
12/08/2025,CASH APP*AIZIHAER TUER,-100.0,Excluded,Non-Finalized (Status: Pending),Excluded,Business/Main,General Authorization,Pending,2025-12-08,2025-12,December,12
12/08/2025,CASH APP*AIZIHAER TUER,-100.0,Excluded,Transfer / Noise,Excluded,Business/Main,General PayPal Debit Card Transaction,Completed,2025-12-08,2025-12,December,12
12/08/2025,TARGET T-1849,-107.26,Included (True Spend),,Grocery/Daily,Business/Main,General PayPal Debit Card Transaction,Completed,2025-12-08,2025-12,December,12
12/08/2025,TRTHFDR*TRUTHFINDER,-32.54,Included (True Spend),,Tech & Subs,Business/Main,General PayPal Debit Card Transaction,Completed,2025-12-08,2025-12,December,12
12/08/2025,TRTHFDR*TRUTHFINDER,-32.54,Included (True Spend),,Tech & Subs,Business/Main,General Authorization,Completed,2025-12-08,2025-12,December,12
12/08/2025,"Uber Technologies, Inc",-19.42,Included (True Spend),,Transportation,Business/Main,PreApproved Payment Bill User Payment,Completed,2025-12-08,2025-12,December,12
12/08/2025,PayPal,-100.0,Excluded,Non-Finalized (Status: Pending),Excluded,Business/Main,Account Hold for Open Authorization,Pending,2025-12-08,2025-12,December,12
12/08/2025,"Uber Technologies, Inc",-19.41,Excluded,Non-Finalized (Status: Pending),Excluded,Business/Main,General Authorization,Pending,2025-12-08,2025-12,December,12
12/08/2025,PAYPRO *NEKTONY,-8.66,Excluded,Non-Finalized (Status: Pending),Excluded,Personal,General Authorization,Pending,2025-12-08,2025-12,December,12
12/08/2025,PayPal,-8.66,Excluded,Non-Finalized (Status: Pending),Excluded,Personal,Account Hold for Open Authorization,Pending,2025-12-08,2025-12,December,12
12/08/2025,PayPal,19.41,Excluded,Money In / Refund,Excluded,Business/Main,Reversal of General Account Hold,Completed,2025-12-08,2025-12,December,12
12/08/2025,PayPal,32.54,Excluded,Money In / Refund,Excluded,Business/Main,Reversal of General Account Hold,Completed,2025-12-08,2025-12,December,12
12/08/2025,PayPal,100.0,Excluded,Money In / Refund,Excluded,Business/Main,Reversal of General Account Hold,Completed,2025-12-08,2025-12,December,12
12/08/2025,Apple Services,-9.99,Included (True Spend),,Tech & Subs,Personal,PreApproved Payment Bill User Payment,Completed,2025-12-08,2025-12,December,12
12/07/2025,1037 NOSTRAND DELI LLC,-16.12,Excluded,Non-Finalized (Status: Pending),Excluded,Personal,General Authorization,Pending,2025-12-07,2025-12,December,12
12/07/2025,WONDER,-8.7,Included (True Spend),,Dining/Restaurants,Business/Main,General PayPal Debit Card Transaction,Completed,2025-12-07,2025-12,December,12
12/07/2025,US MOBILE,-10.57,Included (True Spend),,Transportation,Business/Main,General Authorization,Completed,2025-12-07,2025-12,December,12
12/07/2025,US MOBILE,-10.57,Included (True Spend),,Transportation,Business/Main,General PayPal Debit Card Transaction,Completed,2025-12-07,2025-12,December,12
12/07/2025,WONDER,-10.78,Included (True Spend),,Dining/Restaurants,Business/Main,General Authorization,Completed,2025-12-07,2025-12,December,12
12/07/2025,WONDER,-10.78,Included (True Spend),,Dining/Restaurants,Business/Main,General PayPal Debit Card Transaction,Completed,2025-12-07,2025-12,December,12
12/07/2025,1037 NOSTRAND DELI LLC,-14.3,Included (True Spend),,Grocery/Daily,Business/Main,General Authorization,Completed,2025-12-07,2025-12,December,12
12/07/2025,PayPal,-16.12,Excluded,Non-Finalized (Status: Pending),Excluded,Personal,Account Hold for Open Authorization,Pending,2025-12-07,2025-12,December,12
12/07/2025,,-30.0,Excluded,Non-Finalized (Status: Removed),Excluded,Business/Main,User Initiated Withdrawal,Removed,2025-12-07,2025-12,December,12
12/07/2025,HERCULES CORP KIOSK,-25.0,Included (True Spend),,Services/Laundry,Personal,General Authorization,Completed,2025-12-07,2025-12,December,12
12/07/2025,HERCULES CORP KIOSK,-25.0,Included (True Spend),,Services/Laundry,Personal,General PayPal Debit Card Transaction,Completed,2025-12-07,2025-12,December,12
12/07/2025,,-8.0,Excluded,Non-Finalized (Status: Removed),Excluded,Business/Main,User Initiated Withdrawal,Removed,2025-12-07,2025-12,December,12
12/07/2025,PayPal,-50.0,Excluded,Non-Finalized (Status: Pending),Excluded,Business/Main,Account Hold for Open Authorization,Pending,2025-12-07,2025-12,December,12
12/07/2025,CASH APP*AIZIHAER TUER,-50.0,Excluded,Transfer / Noise,Excluded,Business/Main,General PayPal Debit Card Transaction,Completed,2025-12-07,2025-12,December,12
12/07/2025,CASH APP*AIZIHAER TUER,-50.0,Excluded,Non-Finalized (Status: Pending),Excluded,Business/Main,General Authorization,Pending,2025-12-07,2025-12,December,12
12/07/2025,Aizihaer Tuerxuntuoheti,-100.0,Excluded,Transfer / Noise,Excluded,Business/Main,Mobile Payment,Completed,2025-12-07,2025-12,December,12
12/07/2025,REB NYC,-200.0,Excluded,Transfer / Noise,Excluded,Personal,Mobile Payment,Completed,2025-12-07,2025-12,December,12
12/07/2025,WONDER,-8.7,Included (True Spend),,Dining/Restaurants,Business/Main,General Authorization,Completed,2025-12-07,2025-12,December,12
12/07/2025,1037 NOSTRAND DELI LLC,-14.3,Included (True Spend),,Grocery/Daily,Business/Main,General PayPal Debit Card Transaction,Completed,2025-12-07,2025-12,December,12
12/07/2025,CASH APP*AIZIHAER TUER,-4.86,Excluded,Non-Finalized (Status: Pending),Excluded,Business/Main,General Authorization,Pending,2025-12-07,2025-12,December,12
12/07/2025,PayPal,10.57,Excluded,Money In / Refund,Excluded,Business/Main,Reversal of General Account Hold,Completed,2025-12-07,2025-12,December,12
12/07/2025,CASH APP*AIZIHAER TUER,-4.86,Excluded,Transfer / Noise,Excluded,Business/Main,General PayPal Debit Card Transaction,Completed,2025-12-07,2025-12,December,12
12/07/2025,,200.0,Excluded,Money In / Refund,Excluded,Personal,General Card Deposit,Completed,2025-12-07,2025-12,December,12
12/07/2025,Aizihaer Tuerxuntuoheti,194.02,Excluded,Money In / Refund,Excluded,Business/Main,Mobile Payment,Completed,2025-12-07,2025-12,December,12
12/07/2025,REB NYC,100.0,Excluded,Money In / Refund,Excluded,Personal,Mobile Payment,Completed,2025-12-07,2025-12,December,12
12/07/2025,PayPal,50.0,Excluded,Money In / Refund,Excluded,Business/Main,Reversal of General Account Hold,Completed,2025-12-07,2025-12,December,12
12/07/2025,PayPal,25.0,Excluded,Money In / Refund,Excluded,Personal,Reversal of General Account Hold,Completed,2025-12-07,2025-12,December,12
12/07/2025,PayPal,10.78,Excluded,Money In / Refund,Excluded,Business/Main,Reversal of General Account Hold,Completed,2025-12-07,2025-12,December,12
12/07/2025,PayPal,14.3,Excluded,Money In / Refund,Excluded,Business/Main,Reversal of General Account Hold,Completed,2025-12-07,2025-12,December,12
12/07/2025,PayPal,8.7,Excluded,Money In / Refund,Excluded,Business/Main,Reversal of General Account Hold,Completed,2025-12-07,2025-12,December,12
12/07/2025,PayPal,4.86,Excluded,Money In / Refund,Excluded,Business/Main,Reversal of General Account Hold,Completed,2025-12-07,2025-12,December,12
12/07/2025,,4.79,Excluded,Money In / Refund,Excluded,Business/Main,Debit Card Cash Back Bonus,Completed,2025-12-07,2025-12,December,12
12/07/2025,PayPal,2.9,Excluded,Money In / Refund,Excluded,Business/Main,Reversal of General Account Hold,Completed,2025-12-07,2025-12,December,12
12/07/2025,PayPal Inc.,0.0,Included (True Spend),,Financial Services,Business/Main,Other,Completed,2025-12-07,2025-12,December,12
12/07/2025,MTA*NYCT PAYGO RECOVER,-2.9,Included (True Spend),,Transportation,Business/Main,General Authorization,Completed,2025-12-07,2025-12,December,12
12/07/2025,MTA*NYCT PAYGO RECOVER,-2.9,Included (True Spend),,Transportation,Business/Main,General PayPal Debit Card Transaction,Completed,2025-12-07,2025-12,December,12
12/07/2025,PayPal,-4.86,Excluded,Non-Finalized (Status: Pending),Excluded,Business/Main,Account Hold for Open Authorization,Pending,2025-12-07,2025-12,December,12
12/06/2025,WONDER,-10.78,Excluded,Non-Finalized (Status: Pending),Excluded,Business/Main,General Authorization,Pending,2025-12-06,2025-12,December,12
12/06/2025,T & T Organic Market I,-19.76,Included (True Spend),,Grocery/Daily,Business/Main,General PayPal Debit Card Transaction,Completed,2025-12-06,2025-12,December,12
12/06/2025,T & T Organic Market I,-19.76,Included (True Spend),,Grocery/Daily,Business/Main,General Authorization,Completed,2025-12-06,2025-12,December,12
12/06/2025,TST*JERUSALEM FALAFEL,-14.16,Included (True Spend),,Dining/Restaurants,Business/Main,General PayPal Debit Card Transaction,Completed,2025-12-06,2025-12,December,12
12/06/2025,TST*JERUSALEM FALAFEL,-14.16,Included (True Spend),,Dining/Restaurants,Business/Main,General Authorization,Completed,2025-12-06,2025-12,December,12
12/06/2025,PayPal,-10.78,Excluded,Non-Finalized (Status: Pending),Excluded,Business/Main,Account Hold for Open Authorization,Pending,2025-12-06,2025-12,December,12
12/06/2025,WONDER,-8.7,Excluded,Non-Finalized (Status: Pending),Excluded,Business/Main,General Authorization,Pending,2025-12-06,2025-12,December,12
12/06/2025,PayPal,-10.57,Excluded,Non-Finalized (Status: Pending),Excluded,Business/Main,Account Hold for Open Authorization,Pending,2025-12-06,2025-12,December,12
12/06/2025,PayPal,-8.7,Excluded,Non-Finalized (Status: Pending),Excluded,Business/Main,Account Hold for Open Authorization,Pending,2025-12-06,2025-12,December,12
12/06/2025,PayPal,14.16,Excluded,Money In / Refund,Excluded,Business/Main,Reversal of General Account Hold,Completed,2025-12-06,2025-12,December,12
12/06/2025,PayPal,19.76,Excluded,Money In / Refund,Excluded,Business/Main,Reversal of General Account Hold,Completed,2025-12-06,2025-12,December,12
12/06/2025,US MOBILE,-10.57,Excluded,Non-Finalized (Status: Pending),Excluded,Business/Main,General Authorization,Pending,2025-12-06,2025-12,December,12
12/05/2025,HERCULES CORP KIOSK,-25.0,Excluded,Non-Finalized (Status: Pending),Excluded,Personal,General Authorization,Pending,2025-12-05,2025-12,December,12
12/05/2025,1037 NOSTRAND DELI LLC,-14.3,Excluded,Non-Finalized (Status: Pending),Excluded,Business/Main,General Authorization,Pending,2025-12-05,2025-12,December,12
12/05/2025,T & T Organic Market I,-19.76,Excluded,Non-Finalized (Status: Pending),Excluded,Business/Main,General Authorization,Pending,2025-12-05,2025-12,December,12
12/05/2025,PayPal,-19.76,Excluded,Non-Finalized (Status: Pending),Excluded,Business/Main,Account Hold for Open Authorization,Pending,2025-12-05,2025-12,December,12
12/05/2025,Apple Services,-21.32,Included (True Spend),,Tech & Subs,Personal,PreApproved Payment Bill User Payment,Completed,2025-12-05,2025-12,December,12
12/05/2025,PayPal,-25.0,Excluded,Non-Finalized (Status: Pending),Excluded,Personal,Account Hold for Open Authorization,Pending,2025-12-05,2025-12,December,12
12/05/2025,PayPal,-32.54,Excluded,Non-Finalized (Status: Pending),Excluded,Business/Main,Account Hold for Open Authorization,Pending,2025-12-05,2025-12,December,12
12/05/2025,TRTHFDR*TRUTHFINDER,-32.54,Excluded,Non-Finalized (Status: Pending),Excluded,Business/Main,General Authorization,Pending,2025-12-05,2025-12,December,12
12/05/2025,Aizihaer Tuerxuntuoheti,-40.0,Excluded,Transfer / Noise,Excluded,Business/Main,Mobile Payment,Completed,2025-12-05,2025-12,December,12
12/05/2025,"Uber Technologies, Inc",-42.96,Included (True Spend),,Transportation,Business/Main,PreApproved Payment Bill User Payment,Completed,2025-12-05,2025-12,December,12
12/05/2025,REB NYC,-200.0,Excluded,Transfer / Noise,Excluded,Personal,Mobile Payment,Completed,2025-12-05,2025-12,December,12
12/05/2025,PayPal,-14.16,Excluded,Non-Finalized (Status: Pending),Excluded,Business/Main,Account Hold for Open Authorization,Pending,2025-12-05,2025-12,December,12
12/05/2025,PayPal,-14.3,Excluded,Non-Finalized (Status: Pending),Excluded,Business/Main,Account Hold for Open Authorization,Pending,2025-12-05,2025-12,December,12
12/05/2025,,14.78,Excluded,Money In / Refund,Excluded,Personal,General Card Deposit,Completed,2025-12-05,2025-12,December,12
12/05/2025,TST*JERUSALEM FALAFEL,-14.16,Excluded,Non-Finalized (Status: Pending),Excluded,Business/Main,General Authorization,Pending,2025-12-05,2025-12,December,12
12/05/2025,PayPal,3.07,Excluded,Money In / Refund,Excluded,Business/Main,Reversal of General Account Hold,Completed,2025-12-05,2025-12,December,12
12/05/2025,,200.0,Excluded,Money In / Refund,Excluded,Personal,General Card Deposit,Completed,2025-12-05,2025-12,December,12
12/05/2025,REB NYC,40.0,Excluded,Money In / Refund,Excluded,Personal,Mobile Payment,Completed,2025-12-05,2025-12,December,12
12/05/2025,Apple Services,-6.52,Included (True Spend),,Tech & Subs,Personal,PreApproved Payment Bill User Payment,Completed,2025-12-05,2025-12,December,12
12/05/2025,,9.99,Excluded,Non-Finalized (Status: Denied),Excluded,Personal,General Card Deposit,Denied,2025-12-05,2025-12,December,12
12/05/2025,Aizihaer Tuerxuntuoheti,194.02,Excluded,Money In / Refund,Excluded,Business/Main,Mobile Payment,Completed,2025-12-05,2025-12,December,12
12/05/2025,Apple Services,-2.17,Included (True Spend),,Tech & Subs,Personal,PreApproved Payment Bill User Payment,Completed,2025-12-05,2025-12,December,12
12/05/2025,PayPal,-2.9,Excluded,Non-Finalized (Status: Pending),Excluded,Business/Main,Account Hold for Open Authorization,Pending,2025-12-05,2025-12,December,12
12/05/2025,MTA*NYCT PAYGO RECOVER,-2.9,Excluded,Non-Finalized (Status: Pending),Excluded,Business/Main,General Authorization,Pending,2025-12-05,2025-12,December,12
12/05/2025,HP *INSTANT INK,-3.07,Included (True Spend),,Other/Uncategorized,Business/Main,General Authorization,Completed,2025-12-05,2025-12,December,12
12/05/2025,HP *INSTANT INK,-3.07,Included (True Spend),,Other/Uncategorized,Business/Main,General PayPal Debit Card Transaction,Completed,2025-12-05,2025-12,December,12
12/04/2025,,42.96,Excluded,Non-Finalized (Status: Denied),Excluded,Business/Main,General Card Deposit,Denied,2025-12-04,2025-12,December,12
12/04/2025,,40.24,Excluded,Non-Finalized (Status: Denied),Excluded,Business/Main,General Card Deposit,Denied,2025-12-04,2025-12,December,12
12/04/2025,,-2.72,Excluded,Non-Finalized (Status: Denied),Excluded,Business/Main,Account Hold for Open Authorization,Denied,2025-12-04,2025-12,December,12
12/03/2025,TRTHFDR*TRUTHFINDER,-4.34,Included (True Spend),,Tech & Subs,Business/Main,General Authorization,Completed,2025-12-03,2025-12,December,12
12/03/2025,TARGET.COM,-47.79,Included (True Spend),,Grocery/Daily,Business/Main,General PayPal Debit Card Transaction,Completed,2025-12-03,2025-12,December,12
12/03/2025,T & T Organic Market I,-36.4,Included (True Spend),,Grocery/Daily,Business/Main,General PayPal Debit Card Transaction,Completed,2025-12-03,2025-12,December,12
12/03/2025,T & T Organic Market I,-36.4,Included (True Spend),,Grocery/Daily,Business/Main,General Authorization,Completed,2025-12-03,2025-12,December,12
12/03/2025,PayPal,-12.45,Excluded,Non-Finalized (Status: Pending),Excluded,Business/Main,Account Hold for Open Authorization,Pending,2025-12-03,2025-12,December,12
12/03/2025,TRTHFDR*TRUTHFINDER,-7.62,Included (True Spend),,Tech & Subs,Business/Main,General PayPal Debit Card Transaction,Completed,2025-12-03,2025-12,December,12
12/03/2025,TRTHFDR*TRUTHFINDER,-7.62,Included (True Spend),,Tech & Subs,Business/Main,General Authorization,Completed,2025-12-03,2025-12,December,12
12/03/2025,TRTHFDR*TRUTHFINDER,-4.34,Included (True Spend),,Tech & Subs,Business/Main,General PayPal Debit Card Transaction,Completed,2025-12-03,2025-12,December,12
12/03/2025,PayPal,36.4,Excluded,Money In / Refund,Excluded,Business/Main,Reversal of General Account Hold,Completed,2025-12-03,2025-12,December,12
12/03/2025,HP *INSTANT INK,-3.07,Excluded,Non-Finalized (Status: Pending),Excluded,Business/Main,General Authorization,Pending,2025-12-03,2025-12,December,12
12/03/2025,PayPal,-3.07,Excluded,Non-Finalized (Status: Pending),Excluded,Business/Main,Account Hold for Open Authorization,Pending,2025-12-03,2025-12,December,12
12/03/2025,PayPal Inc.,0.0,Included (True Spend),,Financial Services,Business/Main,Other,Completed,2025-12-03,2025-12,December,12
12/03/2025,PayPal,4.34,Excluded,Money In / Refund,Excluded,Business/Main,Reversal of General Account Hold,Completed,2025-12-03,2025-12,December,12
12/03/2025,PayPal,7.62,Excluded,Money In / Refund,Excluded,Business/Main,Reversal of General Account Hold,Completed,2025-12-03,2025-12,December,12
12/03/2025,PayPal,60.24,Excluded,Money In / Refund,Excluded,Business/Main,Reversal of General Account Hold,Completed,2025-12-03,2025-12,December,12
12/02/2025,T & T Organic Market I,-36.4,Excluded,Non-Finalized (Status: Pending),Excluded,Business/Main,General Authorization,Pending,2025-12-02,2025-12,December,12
12/02/2025,PayPal,-60.24,Excluded,Non-Finalized (Status: Pending),Excluded,Business/Main,Account Hold for Open Authorization,Pending,2025-12-02,2025-12,December,12
12/02/2025,TARGET.COM,-60.24,Excluded,Non-Finalized (Status: Pending),Excluded,Business/Main,General Authorization,Pending,2025-12-02,2025-12,December,12
12/02/2025,PayPal,-36.4,Excluded,Non-Finalized (Status: Pending),Excluded,Business/Main,Account Hold for Open Authorization,Pending,2025-12-02,2025-12,December,12
12/02/2025,PayPal,23.03,Excluded,Money In / Refund,Excluded,Business/Main,Reversal of General Account Hold,Completed,2025-12-02,2025-12,December,12
12/02/2025,WONDER,-23.03,Included (True Spend),,Dining/Restaurants,Business/Main,General PayPal Debit Card Transaction,Completed,2025-12-02,2025-12,December,12
12/02/2025,WONDER,-23.03,Included (True Spend),,Dining/Restaurants,Business/Main,General Authorization,Completed,2025-12-02,2025-12,December,12
12/01/2025,PayPal,-23.03,Excluded,Non-Finalized (Status: Pending),Excluded,Business/Main,Account Hold for Open Authorization,Pending,2025-12-01,2025-12,December,12
12/01/2025,PIECE OF CAKE MOVING &,-270.75,Included (True Spend),,Other/Uncategorized,Business/Main,General PayPal Debit Card Transaction,Completed,2025-12-01,2025-12,December,12
12/01/2025,PIECE OF CAKE MOVING &,-270.75,Included (True Spend),,Other/Uncategorized,Business/Main,General Authorization,Completed,2025-12-01,2025-12,December,12
12/01/2025,CASH APP*AIZIHAER TUER,-50.0,Excluded,Non-Finalized (Status: Pending),Excluded,Business/Main,General Authorization,Pending,2025-12-01,2025-12,December,12
12/01/2025,CASH APP*AIZIHAER TUER,-50.0,Excluded,Transfer / Noise,Excluded,Business/Main,General PayPal Debit Card Transaction,Completed,2025-12-01,2025-12,December,12
12/01/2025,WONDER-GRHUB*EMVIETNAM,-25.04,Included (True Spend),,Dining/Restaurants,Business/Main,General PayPal Debit Card Transaction,Completed,2025-12-01,2025-12,December,12
12/01/2025,WONDER-GRHUB*EMVIETNAM,-25.04,Included (True Spend),,Dining/Restaurants,Business/Main,General Authorization,Completed,2025-12-01,2025-12,December,12
12/01/2025,PayPal,-50.0,Excluded,Non-Finalized (Status: Pending),Excluded,Business/Main,Account Hold for Open Authorization,Pending,2025-12-01,2025-12,December,12
12/01/2025,WONDER,-23.03,Excluded,Non-Finalized (Status: Pending),Excluded,Business/Main,General Authorization,Pending,2025-12-01,2025-12,December,12
12/01/2025,AFFIA MEAT AND GROCERY,-11.82,Included (True Spend),,Grocery/Daily,Business/Main,General Authorization,Completed,2025-12-01,2025-12,December,12
12/01/2025,PayPal,11.82,Excluded,Money In / Refund,Excluded,Business/Main,Reversal of General Account Hold,Completed,2025-12-01,2025-12,December,12
12/01/2025,PayPal,25.04,Excluded,Money In / Refund,Excluded,Business/Main,Reversal of General Account Hold,Completed,2025-12-01,2025-12,December,12
12/01/2025,PayPal,50.0,Excluded,Money In / Refund,Excluded,Business/Main,Reversal of General Account Hold,Completed,2025-12-01,2025-12,December,12
12/01/2025,PayPal,270.75,Excluded,Money In / Refund,Excluded,Business/Main,Reversal of General Account Hold,Completed,2025-12-01,2025-12,December,12
12/01/2025,AFFIA MEAT AND GROCERY,-11.82,Included (True Spend),,Grocery/Daily,Business/Main,General PayPal Debit Card Transaction,Completed,2025-12-01,2025-12,December,12
11/30/2025,"Uber Technologies, Inc",-29.04,Included (True Spend),,Transportation,Business/Main,PreApproved Payment Bill User Payment,Completed,2025-11-30,2025-11,November,11
11/30/2025,PayPal,-25.04,Excluded,Non-Finalized (Status: Pending),Excluded,Business/Main,Account Hold for Open Authorization,Pending,2025-11-30,2025-11,November,11
11/30/2025,WONDER-GRHUB*TAVATURKI,-27.43,Included (True Spend),,Dining/Restaurants,Business/Main,General Authorization,Completed,2025-11-30,2025-11,November,11
11/30/2025,WONDER-GRHUB*TAVATURKI,-27.43,Included (True Spend),,Dining/Restaurants,Business/Main,General PayPal Debit Card Transaction,Completed,2025-11-30,2025-11,November,11
11/30/2025,CASH APP*AIZIHAER TUER,-250.0,Excluded,Non-Finalized (Status: Pending),Excluded,Business/Main,General Authorization,Pending,2025-11-30,2025-11,November,11
11/30/2025,PayPal,-29.04,Excluded,Non-Finalized (Status: Pending),Excluded,Business/Main,Account Hold for Open Authorization,Pending,2025-11-30,2025-11,November,11
11/30/2025,PayPal,-250.0,Excluded,Non-Finalized (Status: Pending),Excluded,Business/Main,Account Hold for Open Authorization,Pending,2025-11-30,2025-11,November,11
11/30/2025,CASH APP*AIZIHAER TUER,-250.0,Excluded,Transfer / Noise,Excluded,Business/Main,General PayPal Debit Card Transaction,Completed,2025-11-30,2025-11,November,11
11/30/2025,PayPal,-23.62,Excluded,Non-Finalized (Status: Pending),Excluded,Business/Main,Account Hold for Open Authorization,Pending,2025-11-30,2025-11,November,11
11/30/2025,WONDER-GRHUB*EMVIETNAM,-25.04,Excluded,Non-Finalized (Status: Pending),Excluded,Business/Main,General Authorization,Pending,2025-11-30,2025-11,November,11
11/30/2025,PayPal,29.04,Excluded,Money In / Refund,Excluded,Business/Main,Reversal of General Account Hold,Completed,2025-11-30,2025-11,November,11
11/30/2025,Uber Eats,-23.62,Included (True Spend),,Transportation,Business/Main,PreApproved Payment Bill User Payment,Completed,2025-11-30,2025-11,November,11
11/30/2025,TRTHFDR*TRUTHFINDER,-7.62,Excluded,Non-Finalized (Status: Pending),Excluded,Business/Main,General Authorization,Pending,2025-11-30,2025-11,November,11
11/30/2025,PayPal,-4.34,Excluded,Non-Finalized (Status: Pending),Excluded,Business/Main,Account Hold for Open Authorization,Pending,2025-11-30,2025-11,November,11
11/30/2025,TRTHFDR*TRUTHFINDER,-4.34,Excluded,Non-Finalized (Status: Pending),Excluded,Business/Main,General Authorization,Pending,2025-11-30,2025-11,November,11
11/30/2025,,2.0,Excluded,Money In / Refund,Excluded,Business/Main,Debit Card Cash Back Bonus,Completed,2025-11-30,2025-11,November,11
11/30/2025,PayPal,23.62,Excluded,Money In / Refund,Excluded,Business/Main,Reversal of General Account Hold,Completed,2025-11-30,2025-11,November,11
11/30/2025,PayPal,27.43,Excluded,Money In / Refund,Excluded,Business/Main,Reversal of General Account Hold,Completed,2025-11-30,2025-11,November,11
11/30/2025,PayPal,-7.62,Excluded,Non-Finalized (Status: Pending),Excluded,Business/Main,Account Hold for Open Authorization,Pending,2025-11-30,2025-11,November,11
11/30/2025,PayPal,250.0,Excluded,Money In / Refund,Excluded,Business/Main,Reversal of General Account Hold,Completed,2025-11-30,2025-11,November,11
11/29/2025,WONDER,-16.67,Excluded,Non-Finalized (Status: Pending),Excluded,Business/Main,General Authorization,Pending,2025-11-29,2025-11,November,11
11/29/2025,T & T Organic Market I,-11.96,Included (True Spend),,Grocery/Daily,Business/Main,General Authorization,Completed,2025-11-29,2025-11,November,11
11/29/2025,T & T Organic Market I,-11.96,Included (True Spend),,Grocery/Daily,Business/Main,General PayPal Debit Card Transaction,Completed,2025-11-29,2025-11,November,11
11/29/2025,WONDER,-16.67,Included (True Spend),,Dining/Restaurants,Business/Main,General PayPal Debit Card Transaction,Completed,2025-11-29,2025-11,November,11
11/29/2025,WONDER-GRHUB*TAVATURKI,-27.43,Excluded,Non-Finalized (Status: Pending),Excluded,Business/Main,General Authorization,Pending,2025-11-29,2025-11,November,11
11/29/2025,PayPal,-16.67,Excluded,Non-Finalized (Status: Pending),Excluded,Business/Main,Account Hold for Open Authorization,Pending,2025-11-29,2025-11,November,11
11/29/2025,WONDER-GRHUB*EMVIETNAM,-19.6,Included (True Spend),,Dining/Restaurants,Business/Main,General Authorization,Completed,2025-11-29,2025-11,November,11
11/29/2025,WONDER-GRHUB*EMVIETNAM,-19.6,Included (True Spend),,Dining/Restaurants,Business/Main,General PayPal Debit Card Transaction,Completed,2025-11-29,2025-11,November,11
11/29/2025,AFTERPAY,-10.27,Excluded,Non-Finalized (Status: Pending),Excluded,Business/Main,General Authorization,Pending,2025-11-29,2025-11,November,11
11/29/2025,PayPal,-27.43,Excluded,Non-Finalized (Status: Pending),Excluded,Business/Main,Account Hold for Open Authorization,Pending,2025-11-29,2025-11,November,11
11/29/2025,PayPal,-11.82,Excluded,Non-Finalized (Status: Pending),Excluded,Business/Main,Account Hold for Open Authorization,Pending,2025-11-29,2025-11,November,11
11/29/2025,AFFIA MEAT AND GROCERY,-11.82,Excluded,Non-Finalized (Status: Pending),Excluded,Business/Main,General Authorization,Pending,2025-11-29,2025-11,November,11
11/29/2025,AFTERPAY,-10.27,Included (True Spend),,Financial Services,Business/Main,General PayPal Debit Card Transaction,Completed,2025-11-29,2025-11,November,11
11/29/2025,PayPal,2.9,Excluded,Money In / Refund,Excluded,Business/Main,Reversal of General Account Hold,Completed,2025-11-29,2025-11,November,11
11/29/2025,PayPal,-10.27,Excluded,Non-Finalized (Status: Pending),Excluded,Business/Main,Account Hold for Open Authorization,Pending,2025-11-29,2025-11,November,11
11/29/2025,PayPal,19.6,Excluded,Money In / Refund,Excluded,Business/Main,Reversal of General Account Hold,Completed,2025-11-29,2025-11,November,11
11/29/2025,PayPal,16.67,Excluded,Money In / Refund,Excluded,Business/Main,Reversal of General Account Hold,Completed,2025-11-29,2025-11,November,11
11/29/2025,PayPal,10.27,Excluded,Money In / Refund,Excluded,Business/Main,Reversal of General Account Hold,Completed,2025-11-29,2025-11,November,11
11/29/2025,PayPal,11.96,Excluded,Money In / Refund,Excluded,Business/Main,Reversal of General Account Hold,Completed,2025-11-29,2025-11,November,11
11/29/2025,MTA*NYCT PAYGO RECOVER,-2.9,Included (True Spend),,Transportation,Business/Main,General Authorization,Completed,2025-11-29,2025-11,November,11
11/29/2025,MTA*NYCT PAYGO RECOVER,-2.9,Included (True Spend),,Transportation,Business/Main,General PayPal Debit Card Transaction,Completed,2025-11-29,2025-11,November,11
11/29/2025,MTA*NYCT PAYGO,-2.9,Included (True Spend),,Transportation,Business/Main,General Authorization,Completed,2025-11-29,2025-11,November,11
11/29/2025,MTA*NYCT PAYGO,-2.9,Included (True Spend),,Transportation,Business/Main,General PayPal Debit Card Transaction,Completed,2025-11-29,2025-11,November,11
11/28/2025,WWW.PAYWITHFOUR.COM,-30.5,Included (True Spend),,Financial Services,Business/Main,General PayPal Debit Card Transaction,Completed,2025-11-28,2025-11,November,11
11/28/2025,"Uber Technologies, Inc",-17.58,Included (True Spend),,Transportation,Business/Main,PreApproved Payment Bill User Payment,Completed,2025-11-28,2025-11,November,11
11/28/2025,T & T Organic Market I,-19.24,Included (True Spend),,Grocery/Daily,Business/Main,General Authorization,Completed,2025-11-28,2025-11,November,11
11/28/2025,T & T Organic Market I,-19.24,Included (True Spend),,Grocery/Daily,Business/Main,General PayPal Debit Card Transaction,Completed,2025-11-28,2025-11,November,11
11/28/2025,WONDER-GRHUB*EMVIETNAM,-19.6,Excluded,Non-Finalized (Status: Pending),Excluded,Business/Main,General Authorization,Pending,2025-11-28,2025-11,November,11
11/28/2025,PayPal,-19.6,Excluded,Non-Finalized (Status: Pending),Excluded,Business/Main,Account Hold for Open Authorization,Pending,2025-11-28,2025-11,November,11
11/28/2025,1037 NOSTRAN-725997,-64.49,Included (True Spend),,Other/Uncategorized,Business/Main,PayPal Debit Card Withdrawal to ATM,Completed,2025-11-28,2025-11,November,11
11/28/2025,WWW.PAYWITHFOUR.COM,-30.5,Excluded,Non-Finalized (Status: Pending),Excluded,Business/Main,General Authorization,Pending,2025-11-28,2025-11,November,11
11/28/2025,PayPal,-30.5,Excluded,Non-Finalized (Status: Pending),Excluded,Business/Main,Account Hold for Open Authorization,Pending,2025-11-28,2025-11,November,11
11/28/2025,"Uber Technologies, Inc",-57.93,Excluded,Non-Finalized (Status: Pending),Excluded,Business/Main,General Authorization,Pending,2025-11-28,2025-11,November,11
11/28/2025,PayPal,-57.93,Excluded,Non-Finalized (Status: Pending),Excluded,Business/Main,Account Hold for Open Authorization,Pending,2025-11-28,2025-11,November,11
11/28/2025,NOSTRAND SMELL SO SWEE,-58.23,Included (True Spend),,Other/Uncategorized,Business/Main,General PayPal Debit Card Transaction,Completed,2025-11-28,2025-11,November,11
11/28/2025,WONDER,-12.47,Excluded,Non-Finalized (Status: Pending),Excluded,Business/Main,General Authorization,Pending,2025-11-28,2025-11,November,11
11/28/2025,PayPal,-12.47,Excluded,Non-Finalized (Status: Pending),Excluded,Business/Main,Account Hold for Open Authorization,Pending,2025-11-28,2025-11,November,11
11/28/2025,NOSTRAND SMELL SO SWEE,-58.23,Included (True Spend),,Other/Uncategorized,Business/Main,General Authorization,Completed,2025-11-28,2025-11,November,11
11/28/2025,WONDER,-12.47,Included (True Spend),,Dining/Restaurants,Business/Main,General PayPal Debit Card Transaction,Completed,2025-11-28,2025-11,November,11
11/28/2025,PayPal,11.98,Excluded,Money In / Refund,Excluded,Business/Main,Reversal of General Account Hold,Completed,2025-11-28,2025-11,November,11
11/28/2025,PayPal,58.23,Excluded,Money In / Refund,Excluded,Business/Main,Reversal of General Account Hold,Completed,2025-11-28,2025-11,November,11
11/28/2025,AFFIA MEAT AND GROCERY,-11.98,Included (True Spend),,Grocery/Daily,Business/Main,General PayPal Debit Card Transaction,Completed,2025-11-28,2025-11,November,11
11/28/2025,PayPal,30.5,Excluded,Money In / Refund,Excluded,Business/Main,Reversal of General Account Hold,Completed,2025-11-28,2025-11,November,11
11/28/2025,PayPal,19.24,Excluded,Money In / Refund,Excluded,Business/Main,Reversal of General Account Hold,Completed,2025-11-28,2025-11,November,11
11/28/2025,PayPal,12.47,Excluded,Money In / Refund,Excluded,Business/Main,Reversal of General Account Hold,Completed,2025-11-28,2025-11,November,11
11/28/2025,PayPal,57.93,Excluded,Money In / Refund,Excluded,Business/Main,Reversal of General Account Hold,Completed,2025-11-28,2025-11,November,11
11/28/2025,PayPal,-2.9,Excluded,Non-Finalized (Status: Pending),Excluded,Business/Main,Account Hold for Open Authorization,Pending,2025-11-28,2025-11,November,11
11/28/2025,WALGREENS STORE,-3.29,Included (True Spend),,Grocery/Daily,Business/Main,General PayPal Debit Card Transaction,Completed,2025-11-28,2025-11,November,11
11/28/2025,T & T Organic Market I,-11.96,Excluded,Non-Finalized (Status: Pending),Excluded,Business/Main,General Authorization,Pending,2025-11-28,2025-11,November,11
11/28/2025,PayPal,-11.96,Excluded,Non-Finalized (Status: Pending),Excluded,Business/Main,Account Hold for Open Authorization,Pending,2025-11-28,2025-11,November,11
11/28/2025,AFFIA MEAT AND GROCERY,-11.98,Included (True Spend),,Grocery/Daily,Business/Main,General Authorization,Completed,2025-11-28,2025-11,November,11
11/28/2025,MTA*NYCT PAYGO,-2.9,Excluded,Non-Finalized (Status: Pending),Excluded,Business/Main,General Authorization,Pending,2025-11-28,2025-11,November,11
11/27/2025,REB NYC,-200.0,Excluded,Transfer / Noise,Excluded,Personal,Mobile Payment,Completed,2025-11-27,2025-11,November,11
11/27/2025,T & T Organic Market I,-19.24,Excluded,Non-Finalized (Status: Pending),Excluded,Business/Main,General Authorization,Pending,2025-11-27,2025-11,November,11
11/27/2025,PayPal,-19.24,Excluded,Non-Finalized (Status: Pending),Excluded,Business/Main,Account Hold for Open Authorization,Pending,2025-11-27,2025-11,November,11
11/27/2025,"Uber Technologies, Inc",-42.26,Included (True Spend),,Transportation,Business/Main,PreApproved Payment Bill User Payment,Completed,2025-11-27,2025-11,November,11
11/27/2025,PayPal,-58.23,Excluded,Non-Finalized (Status: Pending),Excluded,Business/Main,Account Hold for Open Authorization,Pending,2025-11-27,2025-11,November,11
11/27/2025,NOSTRAND SMELL SO SWEE,-58.23,Excluded,Non-Finalized (Status: Pending),Excluded,Business/Main,General Authorization,Pending,2025-11-27,2025-11,November,11
11/27/2025,REB NYC,-300.0,Excluded,Transfer / Noise,Excluded,Personal,General Payment,Completed,2025-11-27,2025-11,November,11
11/27/2025,PayPal,-270.75,Excluded,Non-Finalized (Status: Pending),Excluded,Business/Main,Account Hold for Open Authorization,Pending,2025-11-27,2025-11,November,11
11/27/2025,PIECE OF CAKE MOVING &,-270.75,Excluded,Non-Finalized (Status: Pending),Excluded,Business/Main,General Authorization,Pending,2025-11-27,2025-11,November,11
11/27/2025,REB NYC,-300.0,Excluded,Transfer / Noise,Excluded,Personal,Mobile Payment,Completed,2025-11-27,2025-11,November,11
11/27/2025,Aizihaer Tuerxuntuoheti,-309.0,Excluded,Transfer / Noise,Excluded,Business/Main,Mobile Payment,Completed,2025-11-27,2025-11,November,11
11/27/2025,PayPal,-9.99,Excluded,Non-Finalized (Status: Pending),Excluded,Business/Main,Account Hold for Open Authorization,Pending,2025-11-27,2025-11,November,11
11/27/2025,PayPal,-11.98,Excluded,Non-Finalized (Status: Pending),Excluded,Business/Main,Account Hold for Open Authorization,Pending,2025-11-27,2025-11,November,11
11/27/2025,AFFIA MEAT AND GROCERY,-11.98,Excluded,Non-Finalized (Status: Pending),Excluded,Business/Main,General Authorization,Pending,2025-11-27,2025-11,November,11
11/27/2025,"Uber Technologies, Inc",-9.99,Included (True Spend),,Transportation,Business/Main,PreApproved Payment Bill User Payment,Completed,2025-11-27,2025-11,November,11
11/27/2025,MTA*NYCT PAYGO RECOVER,-2.9,Excluded,Non-Finalized (Status: Pending),Excluded,Business/Main,General Authorization,Pending,2025-11-27,2025-11,November,11
11/27/2025,PayPal,-2.9,Excluded,Non-Finalized (Status: Pending),Excluded,Business/Main,Account Hold for Open Authorization,Pending,2025-11-27,2025-11,November,11
